title,source,description,content,pub_date,url,photo_url
Pakistan moves to bring cryptocurrency boom out of the dark - Reuters,Reuters,"Once a week Ghulam Ahmed, 38, takes time out from his cryptocurrency consulting business to log into a WhatsApp group with hundreds of members eager to learn how to mine and trade cryptocurrency in Pakistan.","Representations of cryptocurrencies Bitcoin, Ethereum, DogeCoin, Ripple, Litecoin are placed on PC motherboard in this illustration taken, June 29, 2021. REUTERS/Dado Ruvic/IllustrationISLAMABAD, Jul… [+4560 chars]",2021-07-16,https://www.reuters.com/technology/pakistan-moves-bring-cryptocurrency-boom-out-dark-2021-07-16/,https://www.reuters.com/resizer/hmwcSxBPZWdzRn-3QEJfX3F0Xww=/1200x628/smart/filters:quality(80)/cloudfront-us-east-2.images.arcpublishing.com/reuters/E3O6WSDKQJM6LO6IWPQ24QTOPA.jpg
How Blockchain and Cryptocurrency Can Revolutionize Businesses,Entrepreneur,A brief overview of blockchain and cryptocurrency's various benefits and applications and how they can transform businesses.,"Opinions expressed by Entrepreneur contributors are their own.
The growth of blockchain and cryptocurrency has been skyrocketing for several years now, and the hype around it is not likely to end ve… [+7229 chars]",2021-07-17,https://www.entrepreneur.com/article/374076,https://assets.entrepreneur.com/content/3x2/2000/1626124172-GettyImages-1288404188.jpg
Chinese cryptocurrency community Bishijie shut down by regulators - Reuters,Reuters,"Bishijie, a Chinese cryptocurrency community and information provider, on Thursday ceased operation of its app and website in mainland China, saying it violated central bank regulations.","By Reuters Staff
FILE PHOTO: Small toy figurines are seen on representations of the Bitcoin virtual currency displayed in front of an image of China's flag in this illustration picture, April 9, 201… [+771 chars]",2021-07-15,https://www.reuters.com/article/us-fintech-bitcoin-china-bishijie-idUSKBN2EL1TE,https://static.reuters.com/resources/r/?m=02&d=20210715&t=2&i=1568971797&r=LYNXMPEH6E0V0&w=800
Chinese cryptocurrency community Bishijie shut down by regulators - Reuters,Reuters,"Bishijie, a Chinese cryptocurrency community and information provider, on Thursday ceased operation of its app and website in mainland China, saying it violated central bank regulations.","Small toy figurines are seen on representations of the Bitcoin virtual currency displayed in front of an image of China's flag in this illustration picture, April 9, 2019. REUTERS/Dado Ruvic/Illustra… [+881 chars]",2021-07-15,https://www.reuters.com/technology/chinese-cryptocurrency-community-bishijie-shut-down-by-regulators-2021-07-15/,https://www.reuters.com/resizer/hpFhP__2PHjLcK_EpFIHlKFHpdk=/1200x628/smart/filters:quality(80)/cloudfront-us-east-2.images.arcpublishing.com/reuters/2SYQXRKO45K4REB36KDVW667KM.jpg
Facebook’s payment system extends to online retailers in August,The Verge,"Starting in August, Facebook Pay will be available for third-party retailers, joining buttons for PayPal, Amazon, Google, and others. It keeps your credit card information secure, but will provide information about your purchases to Facebook.","Shopify stores are up first
Illustration by Alex Castro / The Verge
Online shoppers will eventually see another option listed next to the usual payment methods, now that Facebook Pay will expand be… [+1769 chars]",2021-07-15,https://www.theverge.com/2021/7/15/22578676/facebook-pay-button-shopify-online-payments,https://cdn.vox-cdn.com/thumbor/RKYjLazuTxjNs5ZezTDCT-j5kVA=/0x146:2040x1214/fit-in/1200x630/cdn.vox-cdn.com/uploads/chorus_asset/file/12742497/acastro_180828_1777_facebook_0002.jpg
Hong Kong watchdog says Binance not licensed to sell stock tokens in city - Reuters,Reuters,"Hong Kong's markets watchdog on Friday said Binance, one of the world's largest cryptocurrency exchanges, was not licensed to sell 'stock tokens' in the city, products it said the exchange had offered in other markets.","Biance app is seen on a smartphone in this illustration taken, July 13, 2021. REUTERS/Dado Ruvic/IllustrationHONG KONG, July 16 (Reuters) - Hong Kong's markets watchdog on Friday said Binance, one of… [+1684 chars]",2021-07-16,https://www.reuters.com/business/finance/hong-kong-watchdog-says-binance-not-licensed-sell-stock-tokens-city-2021-07-16/,https://www.reuters.com/resizer/hxh7eXotztSh8YJ4e2EuLz1MToo=/1200x628/smart/filters:quality(80)/cloudfront-us-east-2.images.arcpublishing.com/reuters/UYO5X24OK5KS5KR3VXAIIBMVCQ.jpg
Binance stops selling 'stock tokens' after regulatory scrutiny - Reuters,Reuters,"Major cryptocurrency exchange Binance said on Friday that users can no longer to buy digital tokens linked to stocks, a day after Italian regulators joined a string of financial watchdogs to crackdown on the platform","By Reuters Staff
LONDON, July 16 (Reuters) - Major cryptocurrency exchange Binance said on Friday that users can no longer to buy digital tokens linked to stocks, a day after Italian regulators join… [+783 chars]",2021-07-16,https://www.reuters.com/article/crypto-currency-binance-idUSL8N2OS2UU,https://s1.reutersmedia.net/resources_v2/images/rcom-default.png?w=800
UPDATE 1-Binance stops selling 'stock tokens' after regulatory scrutiny - Reuters,Reuters,"Major cryptocurrency exchange Binance said on Friday that users can no longer buy digital tokens linked to stocks, a day after Italian regulators joined a string of financial watchdogs to crackdown on the platform","FILE PHOTO: Representations of cryptocurrencies Bitcoin, Ethereum, DogeCoin, Ripple, and Litecoin are seen in front of a displayed Binance logo in this illustration taken, June 28, 2021. REUTERS/Dado… [+1465 chars]",2021-07-16,https://www.reuters.com/article/us-crypto-currency-binance-idUSKBN2EM114,https://static.reuters.com/resources/r/?m=02&d=20210716&t=2&i=1569060866&r=LYNXMPEH6F0GW&w=800
"Crypto exchange Binance not authorised, Italian regulators say - Reuters",Reuters,"Italy's market watchdog said on Thursday that major cryptocurrency exchange Binance was not authorised to carry out activities in the country, the latest in a string of global regulatory moves against the platform.","LONDON, July 15 (Reuters) - Italy's market watchdog said on Thursday that major cryptocurrency exchange Binance was not authorised to carry out activities in the country, the latest in a string of gl… [+617 chars]",2021-07-15,https://www.reuters.com/world/china/crypto-exchange-binance-not-authorised-italian-regulators-say-2021-07-15/,https://www.reuters.com/resizer/hxh7eXotztSh8YJ4e2EuLz1MToo=/1200x628/smart/filters:quality(80)/cloudfront-us-east-2.images.arcpublishing.com/reuters/UYO5X24OK5KS5KR3VXAIIBMVCQ.jpg
"China's share of bitcoin mining slumped even before Beijing crackdown, research shows - Reuters",Reuters,"China's share of global bitcoin production power fell sharply even before a recent crackdown by its authorities on cryptocurrency mining, research by the University of Cambridge showed on Thursday.","A Chinese flag is seen among representations of Bitcoin and other cryptocurrencies in this illustration picture taken June 2, 2021. REUTERS/Florence Lo/IllustrationLONDON, July 15 (Reuters) - China's… [+1974 chars]",2021-07-15,https://www.reuters.com/technology/chinas-share-bitcoin-mining-slumped-even-before-beijing-crackdown-research-shows-2021-07-15/,https://www.reuters.com/resizer/bk1nEMR6PyzttlA5p_z-E4vTvXo=/1200x628/smart/filters:quality(80)/cloudfront-us-east-2.images.arcpublishing.com/reuters/37CCDIYR6VPCZDLVEZASNSF6BU.jpg
"China's share of bitcoin mining slumped even before Beijing crackdown, research shows - Reuters",Reuters,"China's share of global bitcoin production power fell sharply even before a recent crackdown by its authorities on cryptocurrency mining, research by the University of Cambridge showed on Thursday.","LONDON, July 15 (Reuters) - Chinas share of global bitcoin production power fell sharply even before a recent crackdown by its authorities on cryptocurrency mining, research by the University of Camb… [+1694 chars]",2021-07-15,https://www.reuters.com/article/fintech-cryptocurrency-bitcoin-idUSL4N2OQ3KN,https://s1.reutersmedia.net/resources_v2/images/rcom-default.png?w=800
Binance ditches 'stock tokens' as global crackdown widens - Reuters,Reuters,"Binance said on Friday it had stopped selling digital tokens linked to shares, as Hong Kong's financial watchdog became the latest in a string of regulators to crack down on the cryptocurrency exchange platform's ""stock tokens"" offerings.","LONDON, July 16 (Reuters) - Binance said on Friday it had stopped selling digital tokens linked to shares, as Hong Kong's financial watchdog became the latest in a string of regulators to crack down … [+3033 chars]",2021-07-16,https://www.reuters.com/world/china/binance-stops-selling-stock-tokens-after-regulatory-scrutiny-2021-07-16/,https://www.reuters.com/resizer/FJXPV_EPm1s3ZCvs5L8r0jwHx0k=/1200x628/smart/filters:quality(80)/cloudfront-us-east-2.images.arcpublishing.com/reuters/MMRN6WEJ6NJT3BP43JTQFUDIHE.jpg
"Want to Buy a Franchise, But Don't Have the Cash? This Company Wants You to Buy In With Crypto.",Entrepreneur,Florida-based moving franchise College Hunks is hoping to cash in on alternative payment methods.,"College Hunks’ first franchisee didn’t have enough cash to pay a franchise fee, but he did have land.
That’s who Nick Friedman, co-founder of moving company College Hunks, credits for sending the co… [+5516 chars]",2021-07-15,https://www.entrepreneur.com/article/376592,https://assets.entrepreneur.com/content/3x2/2000/1625855303-college-hunks-Nick-Friedman-and-Omar-Soliman.jpg
Nym gets $6M for its anonymous overlay mixnet to sell privacy as a service,TechCrunch,"Switzerland-based privacy startup Nym Technologies has raised $6 million, which is being loosely pegged as a Series A round. Earlier raises included a $2.5M seed round in 2019. The founders also took in grant money from the European Union’s Horizon 2020 resea…","Switzerland-based privacy startup Nym Technologies has raised $6 million, which is being loosely pegged as a Series A round.
Earlier raises included a $2.5M seed round in 2019. The founders also too… [+18358 chars]",2021-07-16,http://techcrunch.com/2021/07/16/nym-gets-6m-for-its-anonymous-overlay-mixnet-to-sell-privacy-as-a-service/,https://techcrunch.com/wp-content/uploads/2021/06/GettyImages-1277341511.jpg?w=711
Brazil approves the first investment fund in Latin America listed in the cryptocurrency Ether,Entrepreneur,"This Ether ETF, which will be nicknamed QETH11, will move on the São Paulo B3 stock exchange.","This article was translated from our Spanish edition using AI technologies. Errors may exist due to this process.
The Securities and Exchange Commission (CVM), the body that regulates securities in … [+1015 chars]",2021-07-15,https://www.entrepreneur.com/article/377390,https://assets.entrepreneur.com/content/3x2/2000/1626350007-ethereum.jpg
"Energy consumption is a constant concern in crypto mining, but more sustainable practices are emerging",Business Insider,The surging use of non-fungible tokens (NFTs) and cryptocurrencies calls for increased efforts to make the crypto world more environmentally friendly.,"Over the last several years, non-fungible tokens (NFTs) and cryptocurrencies have exploded in popularity. While the mining of digital currencies such as Bitcoin started in 2009, trading activity on p… [+3324 chars]",2021-07-15,https://www.businessinsider.com/energy-consumption-of-nft-cryptocurrency-mining-and-sustainable-alternatives-2021-7,https://i.insider.com/60ec4c4eca74780018ae8d72?width=1200&format=jpeg
Ethereum Co-Founder Says Safety Concern Has Him Quitting Crypto,Slashdot.org,"""Anthony Di Iorio, a co-founder of the Ethereum network, says he's done with the cryptocurrency world, partially because of personal safety concerns,"" reports Bloomberg, in a story shared by Slashdot reader tekram:

Di Iorio, 48, has had a security team since…","""Anthony Di Iorio, a co-founder of the Ethereum network, says he's done with the cryptocurrency world, partially because of personal safety concerns,"" reports Bloomberg, in a story shared by Slashdot… [+1550 chars]",2021-07-17,https://news.slashdot.org/story/21/07/17/004258/ethereum-co-founder-says-safety-concern-has-him-quitting-crypto,https://a.fsdn.com/sd/topics/money_64.png
"Cathie Wood doubles down on defense of bitcoin as environmentally conscious, and says there is 'nothing better' in terms of ESG",Business Insider,"""Bitcoin mining will probably become part of utility ecosystems, and will proliferate renewables faster than would otherwise be the case,"" Wood said.","ARK Invest
Cathie Wood doubled down on her defense of bitcoin as ""environmentally conscious"", bucking criticism of major figures, including Elon Musk, fn the asset's harmful ecological impact.
""The… [+2038 chars]",2021-07-15,https://markets.businessinsider.com/currencies/news/cathie-wood-ark-bitcoin-esg-cryptocurrency-environmentally-conscious-btc-2021-7,https://images2.markets.businessinsider.com/5efb966a988ee3651a515969?format=jpeg
U.S. launches online hub to help ransomware victims - Reuters,Reuters,"The U.S. government on Thursday unveiled an online hub for the victims of ransomware attacks, saying it will make it easier for companies and municipalities to find resources and get assistance if they are targeted by cyber hackers.","WASHINGTON, July 15 (Reuters) - The U.S. government on Thursday unveiled an online hub for the victims of ransomware attacks, saying it will make it easier for companies and municipalities to find re… [+1895 chars]",2021-07-15,https://www.reuters.com/world/us/us-launches-online-hub-help-ransomware-victims-2021-07-15/,https://www.reuters.com/resizer/5xUnyb0QlBw2-xhwumU2Jbl9llM=/1200x628/smart/filters:quality(80)/cloudfront-us-east-2.images.arcpublishing.com/reuters/WKHOO3WGQJONBC5FYAWZLC56GQ.jpg
These altcoins could help cut down the outrageous energy consumption of Bitcoin,The Next Web,"The cryptocurrency bitcoin now uses up more electricity a year than the whole of Argentina, according to recent estimates from the University of Cambridge. That’s because the creation of a bitcoin, in a process called mining, is achieved by powerful computers…","The cryptocurrency bitcoin now uses up more electricity a year than the whole of Argentina, according to recent estimates from the University of Cambridge. Thats because the creation of a bitcoin, in… [+5352 chars]",2021-07-15,https://thenextweb.com/news/altcoins-cut-down-energy-consumption-bitcoin-syndication,https://img-cdn.tnwcdn.com/image/tnw?filter_last=1&fit=1280%2C640&url=https%3A%2F%2Fcdn0.tnwcdn.com%2Fwp-content%2Fblogs.dir%2F1%2Ffiles%2F2021%2F07%2FCardano-cryptocurrency-green-bitcoin-alternative-hed-shutterstock_1988792945.jpg&signature=98ba418b35a85f1327bb05065b792e40
Jack Dorsey's Square is building a bitcoin-inspired financial services business,Business Insider,"The new company will help developers build financial services products, CEO Jack Dorsey said. He said the name of the business is TBD.","Square is building a new business to help bitcoin developers build financial services products, CEO Jack Dorsey said Thursday.
Dorsey, who is also CEO of Twitter, said that the new business was call… [+717 chars]",2021-07-16,https://www.businessinsider.com/jack-dorsey-square-builds-bitcoin-business-tbd-2021-7,https://i.insider.com/60f147d1016a320018836904?width=1200&format=jpeg
Social Networks Got Rich Off Our Data. Could Creator Coins Help Fight Back?,Entrepreneur,"It's more than ""the human stock market."" It's about taking power back from social media monoliths.","Opinions expressed by Entrepreneur contributors are their own.
In April 2020, a kid named Alex Masmej made news for launching a “human IPO.” He wanted money to move from his home in Paris to Silicon… [+6177 chars]",2021-07-15,https://www.entrepreneur.com/article/375907,https://assets.entrepreneur.com/content/3x2/2000/1625846599-GettyImages-1217890621.jpg
Square to create new bitcoin-focused business - Reuters,Reuters,"Fintech company Square Inc <a href=""https://www.reuters.com/companies/SQ.N"" target=""_blank"">(SQ.N)</a> is creating a new business focused on bitcoin , Chief Executive Officer Jack Dorsey said in a tweet on Thursday.","A Bitcoin (virtual currency) logo is pictured on a door in an illustration picture taken at La Maison du Bitcoin in Paris May 27, 2015. British authorities have come out in support of digital currenc… [+1290 chars]",2021-07-15,https://www.reuters.com/technology/square-create-new-bitcoin-focused-business-2021-07-15/,https://www.reuters.com/resizer/3f40RrogLrg7oE57rv5TmKDcosU=/1200x628/smart/filters:quality(80)/cloudfront-us-east-2.images.arcpublishing.com/reuters/BLZPO6JV3FJKHOTI2O3AQB62HY.jpg
: Italy issues warning over top cryptocurrency exchange Binance,MarketWatch,"Italy on Thursday joined the crackdown against cryptocurrency exchange Binance, the world’s largest.","Italy on Thursday joined the crackdown against cryptocurrency exchange Binance, the worlds largest.The Consob financial regulator said Binance Group companies were not authorized to provide investmen… [+881 chars]",2021-07-15,https://www.marketwatch.com/story/italy-issues-warning-over-top-cryptocurrency-exchange-binance-11626346101,https://images.mktw.net/im-369728/social
UK's Revolut valued at $33 billion after Softbank-backed fundraising - Reuters,Reuters,"British-based digital banking app Revolut has raised around $800 million in a new funding round led by Softbank's Vision Fund and Tiger Global Management, valuing the company at around $33 billion.","By Reuters Staff
LONDON (Reuters) -British-based digital banking app Revolut has raised around $800 million in a new funding round led by Softbanks Vision Fund and Tiger Global Management, valuing t… [+1604 chars]",2021-07-15,https://www.reuters.com/article/uk-revolut-fundraising-idUSKBN2EL0MN,https://s1.reutersmedia.net/resources_v2/images/rcom-default.png?w=800
Revolut becomes UK’s biggest fintech firm with £24bn valuation,The Guardian,It comes after banking app raised $800m from new investors Tiger Global Management and SoftBankThe banking and payments app Revolut has become the most valuable British fintech firm on record after a fresh funding round pushed its valuation to $33bn.The compa…,"The banking and payments app Revolut has become the most valuable British fintech firm on record after a fresh funding round pushed its valuation to $33bn.
The company, founded by the former Lehman … [+1783 chars]",2021-07-15,https://amp.theguardian.com/business/2021/jul/15/revolut-becomes-uk-biggest-fintech-firm,https://i.guim.co.uk/img/media/cd378bca5045dc5a205b5675d19c98c1ea52765f/1569_2306_2515_1509/master/2515.jpg?width=1200&height=630&quality=85&auto=format&fit=crop&overlay-align=bottom%2Cleft&overlay-width=100p&overlay-base64=L2ltZy9zdGF0aWMvb3ZlcmxheXMvdGctZGVmYXVsdC5wbmc&enable=upscale&s=70b7d62650b20fcf06cd2972359f5e72
Podcast: El Salvador wants to be a bitcoin paradise,Yahoo Entertainment,"El Salvador is the first country to make a cryptocurrency legal tender. Some locals like it. To others, it's ""the devil's money.""","A man in Tamanique, El Salvador, makes a purchase at a small store that accepts bitcoin. (Salvador Melendez / Associated Press)
This year, El Salvador President Nayib Bukele made his country the fir… [+730 chars]",2021-07-16,https://news.yahoo.com/podcast-el-salvador-wants-bitcoin-120032749.html,https://s.yimg.com/uu/api/res/1.2/A0dARd87mAdUfeOQl43Hlg--~B/aD01NjA7dz04NDA7YXBwaWQ9eXRhY2h5b24-/https://media.zenfs.com/en/la_times_articles_853/baae76edd0959dc0cf78a580c58fef2f
Biden White House lays out plan to tackle ransomware attacks,Yahoo Entertainment,"Amid an explosion of attention-grabbing ransomware attacks in recent months, the Biden administration Wednesday evening told lawmakers about its plans to...","Anne Neuberger, deputy national security adviser for cyber and emerging technology, at a White House press briefing on May 10. (Drew Angerer/Getty Images)
WASHINGTON Amid an explosion of attention-g… [+5785 chars]",2021-07-15,https://news.yahoo.com/biden-white-house-lays-out-plan-to-tackle-ransomware-attacks-190721510.html,https://s.yimg.com/os/creatr-uploaded-images/2021-07/c35a87b0-e595-11eb-baf3-8573deb4a202
Crypto: Dogecoin co-creator blasts crypto as a scam to help the rich get richer,MarketWatch,"In Twitter thread, Jackson Palmer says crypto industry exploits the ‘worst parts’ of capitalism","Dogecoin was made as a joke, but Jackson Palmer really doesnt think its funny anymore.Palmer, who co-created the mock cryptocurrency in 2013 with Billy Markus, took to Twitter on Wednesday to denounc… [+2355 chars]",2021-07-15,https://www.marketwatch.com/story/dogecoin-co-creator-blasts-crypto-as-a-scam-to-help-the-rich-get-richer-11626310808,https://images.mktw.net/im-369668/social
EXCLUSIVE Japan beefs up diplomatic efforts on regulating digital currency - sources - Reuters,Reuters,"Japan is beefing up its diplomatic efforts to regulate digital currencies globally, three officials told Reuters, a sign of the government's growing alarm that a proliferation of new forms of private money could upend the financial system.","TOKYO, July 16 (Reuters) - Japan is beefing up its diplomatic efforts to regulate digital currencies globally, three officials told Reuters, a sign of the government's growing alarm that a proliferat… [+3476 chars]",2021-07-16,https://www.reuters.com/technology/exclusive-japan-beefs-up-diplomatic-efforts-regulating-digital-currency-sources-2021-07-16/,https://www.reuters.com/resizer/l4dQQyN0-k7X7_Z9928AgRkOcsY=/1200x628/smart/filters:quality(80)/cloudfront-us-east-2.images.arcpublishing.com/reuters/R746NGR54NPBTCH77TWQG6YMXY.jpg
Bitcoin miners flocked to US ahead of Chinese crypto crackdown,Yahoo Entertainment,"Bitcoin miners flocked to the US and Kazakhstan as China's government prepared to crack down on the currency, new data shows. America's share of worldwide...","An employee works at the data centre of BitRiver company providing services for cryptocurrency mining in the city of Bratsk in Irkutsk Region, Russia March 2, 2021. BitRiver offers hosting services a… [+3668 chars]",2021-07-15,https://news.yahoo.com/bitcoin-miners-flocked-us-ahead-054126978.html,https://s.yimg.com/ny/api/res/1.2/5tsy5qU3kY9S8.LSEDmNPA--/YXBwaWQ9aGlnaGxhbmRlcjt3PTIwMDA7aD0xMjUw/https://s.yimg.com/uu/api/res/1.2/0PjUhHT1myf1vEvdeVyBqQ--~B/aD0xNTYzO3c9MjUwMDthcHBpZD15dGFjaHlvbg--/https://media.zenfs.com/en/the_telegraph_258/6fb51db14fe20dcfe7fd61564be475bb
Business this week,The Economist,The world this week,The European Union unveiled ambitious goals to reduce greenhouse-gas emissions by 55% by 2030 (compared with 1990 levels) and to reach net zero by 2050. The plan sets out a range of policies to help … [+4622 chars],2021-07-15,https://www.economist.com/the-world-this-week/2021/07/15/business-this-week,https://www.economist.com/img/b/1280/720/90/sites/default/files/20210717_WWP502.jpg
"Dogecoin Co-Creator Says Cryptocurrency Is Now ""Controlled by a Powerful Cartel of Wealthy Figures""",HYPEBEAST,"Dogecoin co-creator, Jackson Palmer, recently resurfaced on Twitter to offer his thoughts on the current state of cryptocurrency.In a lengthy scathing thread, Palmer continued to share his negative view of cryptocurrencies, openly calling the digital asset ""a…","Dogecoin co-creator, Jackson Palmer, recently resurfaced on Twitter to offer his thoughts on the current state of cryptocurrency.
In a lengthy scathing thread, Palmer continued to share his negative… [+2862 chars]",2021-07-15,https://hypebeast.com/2021/7/dogecoin-co-creator-jackason-palmer-cryptocurrency-scathing-twitter-thread-info,https://image-cdn.hypb.st/https%3A%2F%2Fhypebeast.com%2Fimage%2F2021%2F07%2Fdogecoin-co-creator-jackason-palmer-cryptocurrency-scathing-twitter-thread-info-tw.jpg?w=960&cbr=1&q=90&fit=max
: NFL star Saquon Barkley will accept all future endorsement money in bitcoin,MarketWatch,New York Giants running back Saquon Barkley will now take the millions he earns from endorsements exclusively in bitcoin.,The star New York Giants running back claimed on The Best Business Show that he is accepting all future marketing and endorsement deals he signs in bitcoin.You see inflation and you see how high it i… [+1883 chars],2021-07-16,https://www.marketwatch.com/story/nfl-star-saquon-barkley-will-accept-all-future-endorsement-money-in-bitcoin-11626463979,https://images.mktw.net/im-370871/social
"Dogecoin's Co-Founder Denounces The Industry, Compares Crypto to A Pyramid Scheme",Cracked.com,"Doge's co-creator doesn't feel ""very wow"" about the crypto he helped invent.","Since its origin as a joke in 2013, Dogecoin has found itself a rising, memetic star in the world of cryptocurrency. Boasting the undying love of Elon Musk and a market cap of an estimated $54 billio… [+2366 chars]",2021-07-16,https://www.cracked.com/article_30767_dogecoins-co-founder-denounces-doge-compares-crypto-to-a-pyramid-scheme.html,https://s3.crackedcdn.com/phpimages/article/1/8/0/785180.jpg
