title,source,description,content,pub_date,url,photo_url
Bitcoin ‘Has Made So Many Wealthy’—Coinbase CEO Hits Back At Dogecoin Creator After Attack On ‘Cult-Like’ Crypto Price Culture,Forbes,"The bitcoin and cryptocurrency has been rocked this week by an attack on crypto by the co-creator of meme-based dogecoin—something he said he made as a ""joke""...","The world of bitcoin and cryptocurrency has been rocked this week by an attack on crypto by the co-creator of the meme-based dogecoinsomething he said he made as a ""joke.""
In a series of tweets, Jac… [+4525 chars]",2021-07-16,https://www.forbes.com/sites/billybambrough/2021/07/16/bitcoin-has-made-so-many-wealthy-coinbase-ceo-hits-back-at-dogecoin-creator-after-attack-on-cult-like-crypto-price-culture/,https://thumbor.forbes.com/thumbor/fit-in/1200x0/filters%3Aformat%28jpg%29/https%3A%2F%2Fspecials-images.forbesimg.com%2Fimageserve%2F1182943846%2F0x0.jpg
Why Bitcoin and Square Popped Today -- But Dogecoin Dropped,Motley Fool,"Square's a Bitcoin fan, but criticism from Dogecoin's creator still stings.","What happened
Is the slump in Bitcoin (CRYPTO:BTC) finally over?
It's no secret by now -- the price of the world's foremost cryptocurrency has cratered over the last couple of months, falling 46% f… [+2676 chars]",2021-07-16,https://www.fool.com/investing/2021/07/16/why-bitcoin-and-square-popped-but-dogecoin-dropped/,https://g.foolcdn.com/editorial/images/633938/cartoon-man-in-suit-next-to-a-smartphone-and-surrounded-by-a-cloud-of-bitcoins.jpg
What is Terra? Your guide to the hot cryptocurrency,Yahoo Entertainment,"Terra crypto, overseen by Terraform Labs, is a stablecoin that is intended to track the U.S. dollar.","With cryptocurrencies like Bitcoin, Ether, and Dogecoin gyrating in value over the past few months, many people are looking at so-called stablecoins like Terra to invest in because of their more pred… [+5489 chars]",2021-07-16,https://finance.yahoo.com/news/terra-guide-hot-cryptocurrency-160000501.html,https://s.yimg.com/ny/api/res/1.2/tualYN8TcZRL4ttbTli4pA--/YXBwaWQ9aGlnaGxhbmRlcjt3PTIwMDA7aD0xMzMz/https://s.yimg.com/uu/api/res/1.2/Zjah_q8cLoxpYRBzgN9ttQ--~B/aD0yMDAwO3c9MzAwMDthcHBpZD15dGFjaHlvbg--/https://media.zenfs.com/en/fortune_175/b2997eca25f9fe30d30db2b31d5c089f
Cryptocurrency Is Here To Stay And So Is Coinbase,Yahoo Entertainment,"The largest U.S. cryptocurrency exchange, Coinbase (NASDAQ:COIN) stock has become a familiar name today. Majority new investors in Bitcoin (CCC:BTC-USD) use ...","The largest U.S. cryptocurrency exchange, Coinbase (NASDAQ:COIN) stock has become a familiar name today. Majority new investors in Bitcoin (CCC:BTC-USD) use Coinbase. The company went public via a di… [+4066 chars]",2021-07-16,https://finance.yahoo.com/news/cryptocurrency-stay-coinbase-140050472.html,https://s.yimg.com/uu/api/res/1.2/UTa0EpyW7qc.wLcrvPoLhQ--~B/aD00MDA7dz03Mjg7YXBwaWQ9eXRhY2h5b24-/https://media.zenfs.com/en/investorplace_417/7b4c096597d67c210b8a088bd3edb26c
Bitcoin edges lower for its worst weekly performance in over a month as as cryptocurrencies struggle to recover from heavy sell-off,Business Insider,Other major cryptocurrencies are also trading lower on Friday. The market has struggled to rebound since a broader crash in May.,"Representations of virtual currency bitcoin are placed on US dollar banknotes taken May 26, 2020.
REUTERS/Dado Ruvic
Bitcoin slipped Friday to clock worst weekly performance in more than a month as… [+1728 chars]",2021-07-16,https://markets.businessinsider.com/currencies/news/bitcoin-price-falls-lowest-july-cryptocurrencies-selloff-eth-doge-powell-2021-7,https://images2.markets.businessinsider.com/6094454df22c6b00185dcbd9?format=jpeg
Dogecoin Co-Founder Calls Cryptocurrency a Scam to Help the Rich Get Richer,Barron's,"Jackson Palmer, who co-founded Dogecoin, alleged that “the cryptocurrency industry is controlled by a powerful cartel of wealthy figures.”","One of the key architects of the cryptocurrency Dogecoin has made a rare appearance to attack virtual currencies.
 Jackson Palmer,
 who co-founded Dogecoinnamed after a dog memeback in 2013, has la… [+2037 chars]",2021-07-15,https://www.barrons.com/articles/dogecoin-co-founder-calls-cryptocurrency-a-scam-to-help-the-rich-get-richer-51626359113,https://images.barrons.com/im-369828/social
Dogecoin Co-Founder Calls Cryptocurrency a Scam to Help the Rich Get Richer,Barron's,"Jackson Palmer, who co-founded Dogecoin, alleged that “the cryptocurrency industry is controlled by a powerful cartel of wealthy figures.”","One of the key architects of the cryptocurrency Dogecoin has made a rare appearance to attack virtual currencies.
 Jackson Palmer,
 who co-founded Dogecoinnamed after a dog memeback in 2013, has la… [+2037 chars]",2021-07-15,https://www.barrons.com/articles/jackson-palmer-dogecoin-51626359113,https://images.barrons.com/im-369828/social
"Special SSDs for Chia mining launched by PNY, all-new LX2030 and LX3030 are here",Neowin,"PNY has launched its new LX series of M.2 PCIe Gen 3 NVMe SSDs, namely the LX3030 and LX2030 models. The new SSDs are designed for Chia cryptocurrency mining with very high endurance (TBW) ratings. Read more...","PNY was recently caught cutting down SSD write endurances in order to deter Chia crypto-coin miners. However, it seems the firm has figured that this will also affect normal users as well who won't b… [+1282 chars]",2021-07-16,https://www.neowin.net/news/special-ssds-for-chia-mining-launched-by-pny-all-new-lx2030-and-lx3030-are-here/,https://cdn.neow.in/news/images/uploaded/2021/07/1626417570_pny-lx2030-lx3030_story.jpg
Trend To Integrate Cryptocurrency With MLM Software – ICO APP Factory,Visual.ly,"To know more about our services please visit:

https://www.icoappfactory.com/
Phone  : +91 7397224461

Under this digital age, E-currency is playing a",Trend To Integrate Cryptocurrency With MLM Software - 1CO APP Factory Trend to integrate Cryptocurrency with MLM Software www.icoappfactory.com Call /Whatsapp :+917397224461 O ICO APP FACTORY To know… [+782 chars],2021-07-15,https://visual.ly/community/Infographics/business/trend-integrate-cryptocurrency-mlm-software-%E2%80%93-ico-app-factory,https://thumbnails-visually.netdna-ssl.com/trend-to-integrate-cryptocurrency-with-mlm-software--ico-app-factory_60f012edc4e19_w250_h250.jpg
How Cryptocurrency Is Changing Remittances,Yahoo Entertainment,"Over the next 5 years, the global remittance industry is set to be worth just under $1 trillion. For developing countries that rely so heavily on thes...","Over the next 5 years, the global remittance industry is set to be worth just under $1 trillion. For developing countries that rely so heavily on these funds, how that money is sent is crucial. Block… [+5727 chars]",2021-07-15,https://finance.yahoo.com/news/cryptocurrency-changing-remittances-164530383.html,https://s.yimg.com/cv/apiv2/social/images/yahoo_default_logo-1200x1200.png
3 Top Stocks in Fintech,Motley Fool,Sometimes the best place to look for an investment is at the top.,"Financial technology, or fintech, is much bigger than the giant payments companies that get most of the attention. It also comprises many smaller innovators like card issuer Marqeta and lending platf… [+5230 chars]",2021-07-15,https://www.fool.com/investing/2021/07/15/3-top-stocks-in-fintech/,https://g.foolcdn.com/editorial/images/632353/a-woman-sitting-in-a-restaurant-and-paying-with-a-credit-card.jpg
Watch Malaysian officials destroy hundreds of mining rigs with steamroller,SlashGear,"Officials in Malaysia have taken drastic measures to ensure more than a thousand mining rigs won’t make their way back onto the market to siphon more energy from the nation’s power grid. Local media has published a video of 1,069 mining rigs spread across the…",Officials in Malaysia have taken drastic measures to ensure more than a thousand mining rigs won’t make their way back onto the market to siphon more energy from the nation’s power grid. Local media … [+1718 chars],2021-07-17,https://www.slashgear.com/watch-malaysian-officials-destroy-hundreds-of-mining-rigs-with-steamroller-17682851/,https://cdn.slashgear.com/wp-content/uploads/2021/07/malaysian-officials-steam-roll-mining-rigs.jpg
AMBCrypto Launches World's First Cryptocurrency E-Paper,Yahoo Entertainment,"AMBCrypto, a cryptocurrency news portal announced the launch of the world's first cryptocurrency E-Paper. ""With this new E-Paper, we have captured an...","BANGALORE, India, July 15, 2021 /PRNewswire/ -- AMBCrypto, a cryptocurrency news portal announced the launch of the world's first cryptocurrency E-Paper
. ""With this new E-Paper, we have captured an… [+2194 chars]",2021-07-15,https://finance.yahoo.com/news/ambcrypto-launches-worlds-first-cryptocurrency-160200860.html,https://s.yimg.com/uu/api/res/1.2/WBwYlXmpMLNsF0g.tqpCEQ--~B/aD0yNTI7dz00MDA7YXBwaWQ9eXRhY2h5b24-/https://media.zenfs.com/en/prnewswire.com/5587b1855b40770f19d7d3da3e176453
What Are Altcoins — and Are the Potential Rewards Worth the Risks?,Yahoo Entertainment,"Chances are, you've heard of Bitcoin. Created in 2009, Bitcoin was the first widely accepted cryptocurrency, but it's by no means the only cryptocurrency...","Chances are, youve heard of Bitcoin. Created in 2009, Bitcoin was the first widely accepted cryptocurrency, but its by no means the only cryptocurrency. 
Read: 10 Best Cryptocurrencies To Invest in … [+6084 chars]",2021-07-16,https://finance.yahoo.com/news/altcoins-potential-rewards-worth-risks-220047121.html,https://s.yimg.com/uu/api/res/1.2/vJVUyYrdFlK5_5L1yxIhbQ--~B/aD0xMDgwO3c9MTkyMDthcHBpZD15dGFjaHlvbg--/https://media.zenfs.com/en/gobankingrates_644/a7286a93d601fb0c3a10323d5eb20bab
"PayPal increases weekly cryptocurrency purchase limit to $100,00 and eliminates annual buying cap",TechSpot,"Doing some quick math, it’s now possible for eligible buyers to purchase up to $5.2 million worth of cryptocurrency over the span of one year.",What just happened? PayPal is making cryptocurrency more accessible on its platform. The financial services provider recently raised the purchase limit of cryptocurrency for eligible customers to $10… [+1165 chars],2021-07-16,https://www.techspot.com/news/90447-paypal-increases-weekly-cryptocurrency-purchase-limit-10000-eliminates.html,https://static.techspot.com/images2/news/bigimage/2021/07/2021-07-16-image-2.jpg
Understanding the Concept of Block Rewards,Visual.ly,"Once you understand all the crucial concepts, you may start searching for the best cryptocurrency development company. Let us dive straight into it. B",WHAT ROLE DOES BLOCK REWARD PLAY IN BITCOIN MINING? THE E-BOOK ROUTE WHAT IS A BLOCK REWARD? The process of solving these cryptographic problems refers to mining. And the coins rewarded to miners for… [+986 chars],2021-07-16,https://visual.ly/community/Infographics/computers/understanding-concept-block-rewards,https://thumbnails-visually.netdna-ssl.com/understanding-the-concept-of-block-rewards_60f1787454241_w250_h250.jpg
How Blockchain and Cryptocurrency Can Revolutionize Businesses,Yahoo Entertainment,A brief overview of blockchain and cryptocurrency's various benefits and applications and how they can transform businesses.,"The growth of blockchain and cryptocurrency has been skyrocketing for several years now, and the hype around it is not likely to end very soon. More and more people are investing in cryptocurrency ea… [+7165 chars]",2021-07-17,https://finance.yahoo.com/news/blockchain-cryptocurrency-revolutionize-businesses-170000741.html,https://s.yimg.com/uu/api/res/1.2/.m56mp8ecHEE7eEE1VU1Ig--~B/aD0xMzMzO3c9MjAwMDthcHBpZD15dGFjaHlvbg--/https://media.zenfs.com/en/entrepreneur.com/0f7c5ee995da84a78ad967f347f2008b
PNY LX2030 and LX3030 SSDs are optimized for Chia (XCH) cryptocurrency plotting,BetaNews,"Cryptocurrencies, such as Bitcoin are wildly popular these days. Whether or not it's smart to invest in these digital currencies is up for debate. Of course, the same can be said about any investment -- including stocks. With that said, cryptocurrency volatil…","Cryptocurrencies, such as Bitcoin are wildly popular these days. Whether or not it's smart to invest in these digital currencies is up for debate. Of course, the same can be said about any investment… [+2977 chars]",2021-07-15,https://betanews.com/2021/07/15/pny-xch-lx2030-lx3030-ssd-chia-plotting/,https://betanews.com/wp-content/uploads/2021/07/PNY-CHIA-M.2-NVMe-50x50.jpg
Bitcoin rises as ways to avoid taxes emerge - Fox Business,Fox Business,Bitcoin rises as ways to avoid taxes emerge  Fox Business,"Bitcoin
 traded higher by more than 1% early Thursday morning.
The price was around $32,360 per coin, while rivals Ethereum and Dogecoin
 were trading around $1,950 and 19 cents per coin, respecti… [+2557 chars]",2021-07-15,https://www.foxbusiness.com/markets/bitcoin-7-15,https://a57.foxnews.com/static.foxbusiness.com/foxbusiness.com/content/uploads/2021/05/0/0/GettyImages-1233004873.jpg?ve=1&tl=1
The creator of Dogecoin says all crypto is a scam,TechSpot,"Software engineer Palmer, who created the payment system with Billy Markus in 2013 as a joke based on the ""doge"" meme, has been absent from Twitter since making his account private in 2019. He returned with a bang yesterday, slamming cryptocurrency as a way f…","A hot potato: Despite its meteoric rise over the last decade, there are still those who think cryptocurrency in all its forms is a scam. On that list of skeptics is a surprising name: Jackson Palmer,… [+2550 chars]",2021-07-15,https://www.techspot.com/news/90432-creator-dogecoin-crypto-scam.html,https://static.techspot.com/images2/news/bigimage/2021/05/2021-05-05-image-10.jpg
KSI says he made £7m in Bitcoin investment but ‘lost it all’,Independent,YouTube star and rapper invested in cryptocurrency less than a year ago,"KSI has revealed he lost a staggering amount of money after a bad investment in Bitcoin.
The YouTube star and rapper admitted to the loss during an interview with Made in Chelsea star Jamie Laing on… [+1052 chars]",2021-07-17,https://www.independent.co.uk/arts-entertainment/music/news/ksi-bitcoin-youtube-b1885801.html,https://static.independent.co.uk/2021/07/17/09/newFile-1.jpg?width=1200&auto=webp&quality=75
Nym gets $6M for its anonymous overlay mixnet to sell privacy as a service,TechCrunch,"Switzerland-based privacy startup Nym Technologies has raised $6 million, which is being loosely pegged as a Series A round.  The founders also took in grant...","Switzerland-based privacy startup Nym Technologies has raised $6 million, which is being loosely pegged as a Series A round.
Earlier raises included a $2.5M seed round in 2019. The founders also too… [+18435 chars]",2021-07-16,https://techcrunch.com/2021/07/16/nym-gets-6m-for-its-anonymous-overlay-mixnet-to-sell-privacy-as-a-service/,https://s.yimg.com/ny/api/res/1.2/ClvDffYsjT2bhzrzKAQGxg--/YXBwaWQ9aGlnaGxhbmRlcjt3PTIwMDA7aD0xMTI1/https://s.yimg.com/uu/api/res/1.2/XGwX1NQ1fs7qBdk3rfXvDw--~B/aD0zMjQwO3c9NTc2MDthcHBpZD15dGFjaHlvbg--/https://media.zenfs.com/en/techcrunch_350/adddd22963fcb39420f3d33b4140ac3d
This Week In Credit Card News: Check Your Credit Report For Errors; The Growing Popularity Of NFTs,Forbes,What took place this week in the credit card and payment industries,"34% of Americans Have Found a Credit Report Error
Your credit report is a pretty important document. Not only does it contain information about the loans and credit cards you have open, it contains … [+6468 chars]",2021-07-16,https://www.forbes.com/sites/billhardekopf/2021/07/16/this-week-in-credit-card-news-check-your-credit-report-for-errors-the-growing-popularity-of-nfts/,https://thumbor.forbes.com/thumbor/fit-in/1200x0/filters%3Aformat%28jpg%29/https%3A%2F%2Fspecials-images.forbesimg.com%2Fimageserve%2F60f1a98b2ced446cb7ca741a%2F0x0.jpg
What’s in My Cryptocurrency Portfolio,The New Yorker,Colin Heasley’s humorous Daily Shouts offers advice on a wide range of boutique cryptocurrency investments for people looking to make even greater financial returns.,"In a time of financial uncertainty, the cryptocurrency craze is taking global markets by storm. From prep-school teens on the Upper East Side to weird loners in Minnesota basements, everyone has dece… [+3483 chars]",2021-07-17,https://www.newyorker.com/humor/daily-shouts/whats-in-my-cryptocurrency-portfolio,"https://media.newyorker.com/photos/60f221069540cc0f0d18b73f/16:9/w_1280,c_limit/Heasley-CryptocurrencyPortfolio.jpg"
Indian internet startups are trying to make the most of the Zomato IPO buzz,Quartz India,"Zomato's rival food delivery app Swiggy's notification asked customers to ""invest"" in confections to celebrate the IPO,","The rare IPO of an Indian tech unicorn is widely believed to open the gates of local bourses for many other startups in the country. But while that is still far in the future, at least one Indian ven… [+2311 chars]",2021-07-16,https://qz.com/india/2033941/paytm-money-swiggy-and-dunzo-celebrate-the-zomato-ipo-frenzy/,https://cms.qz.com/wp-content/uploads/2021/07/2018-08-29T000000Z_893427642_RC1BCABB1700_RTRMADP_3_PAYTM-ECOMMERCE-e1626410148283.jpg?quality=75&strip=all&w=1200&h=630&crop=1
"TechX Closes Acquisition of Leading Cryptocurrency Payment Technology Gateway, Mobilum",Yahoo Entertainment,"TechX Technologies Inc. (""TechX'' or the ""Company'') (CSE: TECX) (OTC: TECXF) (FRA: C0B1), a technology driven company making traditional finance accessible ...","VANCOUVER, BC, July 15, 2021 /CNW/ - TechX Technologies Inc.
 (""TechX'' or the ""Company'') (CSE: TECX) (OTC: TECXF) (FRA: C0B1), a technology driven company making traditional finance accessible thr… [+4896 chars]",2021-07-15,https://finance.yahoo.com/news/techx-closes-acquisition-leading-cryptocurrency-113000117.html,https://s.yimg.com/uu/api/res/1.2/Vh27.PRlg_t4Itt1VPH0jg--~B/aD0xMTg7dz00MDA7YXBwaWQ9eXRhY2h5b24-/https://media.zenfs.com/en/cnwgroup.com/cf5c587b12cf3d245d0141b2e419a88f
"TechX Closes Acquisition of Leading Cryptocurrency Payment Technology Gateway, Mobilum",Yahoo Entertainment,"TechX Technologies Inc. (""TechX'' or the ""Company'') (CSE: TECX) (OTC: TECXF) (FRA: C0B1), a technology driven company making traditional finance accessible ...","VANCOUVER, BC, July 15, 2021 /PRNewswire/ - TechX Technologies Inc.
 (""TechX'' or the ""Company'') (CSE: TECX) (OTC: TECXF) (FRA: C0B1), a technology driven company making traditional finance accessi… [+4790 chars]",2021-07-15,https://finance.yahoo.com/news/techx-closes-acquisition-leading-cryptocurrency-113000226.html,https://s.yimg.com/uu/api/res/1.2/1hi4wtoJNrwv1BICqFaSdQ--~B/aD0xMTg7dz00MDA7YXBwaWQ9eXRhY2h5b24-/https://media.zenfs.com/en/prnewswire.com/cf5c587b12cf3d245d0141b2e419a88f
Chinese cryptocurrency community Bishijie shut down by regulators,Yahoo Entertainment,"Bishijie, a Chinese cryptocurrency community and information provider, on Thursday ceased operation of its app and website in mainland China, saying it...","SHANGHAI (Reuters) - Bishijie, a Chinese cryptocurrency community and information provider, on Thursday ceased operation of its app and website in mainland China, saying it violated central bank regu… [+617 chars]",2021-07-15,https://finance.yahoo.com/news/chinese-cryptocurrency-community-bishijie-shut-144825444.html,https://s.yimg.com/uu/api/res/1.2/eb_28e8Dny7S48mv6HffYg--~B/aD01NTI7dz04MDA7YXBwaWQ9eXRhY2h5b24-/https://media.zenfs.com/en/reuters-finance.com/edf3718b24e840b298bc2f8ba5d65870
Cryptocurrency Exchange Binance to Stop Support for Stock Tokens,Yahoo Entertainment,(Bloomberg) -- Binance Holdings Ltd. is phasing out support for stock tokens just a few months after the cryptocurrency exchange started to offer the...,"Cryptocurrency Exchange Binance to Stop Support for Stock Tokens
(Bloomberg) --
Binance Holdings Ltd. is phasing out support for stock tokens just a few months after the cryptocurrency exchange sta… [+1596 chars]",2021-07-16,https://finance.yahoo.com/news/cryptocurrency-exchange-binance-stop-support-114951076.html,https://s.yimg.com/uu/api/res/1.2/SMIZi8BmU.Sx0k2_aInWCw--~B/aD0yMDY7dz0yODA7YXBwaWQ9eXRhY2h5b24-/https://media.zenfs.com/en/bloomberg_markets_842/408cc3e83f1962a2795e641a8adf6e64
