title,source,description,content,pub_date,url,photo_url
El Salvador - Witnessing a New Age of Economic System with Cryptocurrency,Yahoo Entertainment,"SAN SALVADOR, EL SALVADOR / ACCESSWIRE / September 3, 2021 / The bill passed by the El Salvador government in June of 2021 comes into effect from September, ...","SAN SALVADOR, EL SALVADOR / ACCESSWIRE / September 3, 2021 / The bill passed by the El Salvador government in June of 2021 comes into effect from September, and the entire nation is now preparing for… [+3237 chars]",2021-09-03,https://finance.yahoo.com/news/el-salvador-witnessing-age-economic-114500351.html,https://s.yimg.com/ny/api/res/1.2/NbY.4txlFT_UeoMH9l_Ydw--/YXBwaWQ9aGlnaGxhbmRlcjt3PTEyMDA7aD02NzU-/https://s.yimg.com/uu/api/res/1.2/qdWiMbcEc.BYNZKUjV3M2A--~B/aD03MjA7dz0xMjgwO2FwcGlkPXl0YWNoeW9u/https://media.zenfs.com/en/accesswire.ca/7147cd3a92ad93d727b6f6967389b5cf
Coinbase for $10 worth of Bitcoin free w/ signup,Dealnews.com,"A DealNews exclusive! Buy and sell cryptocurrency with Coinbase and get free Bitcoin when you sign up using coupon code ""DEALNEWS10"" and verify your ID. 
 Features
 <ul> <li>You don't have to buy the whole coin! Buy Bitcoin from just $10 (transaction fees a…","A DealNews exclusive!Buy and sell cryptocurrency with Coinbase and get free Bitcoin when you sign up using coupon code ""DEALNEWS10"" and verify your ID. 
<ul><li>You don't have to buy the whole coin!… [+570 chars]",2021-09-05,https://www.dealnews.com/Coinbase-for-10-worth-of-Bitcoin-free-w-signup/19523648.html,"https://cdlnws.a.ssl.fastly.net/image/upload/f_auto,t_maximum,q_auto/content/yszr83igvo28tppiy3dk.png"
Cryptocurrency can actually make a difference by helping people,Cointelegraph,"Crypto donations help save a local Pomona gym with help from Crypto Twitter, as one local influencer rallied the community to save the boxing gym.","Between Bitcoin (BTC) breaking the $50,000 hurdle and the upswell in the altcoin markets, crypto has never been more appealing to speculators. But, stacking profits through trading is worthless unles… [+4422 chars]",2021-09-05,https://cointelegraph.com/news/cryptocurrency-can-actually-make-a-difference-by-helping-people,https://images.cointelegraph.com/images/1200_aHR0cHM6Ly9zMy5jb2ludGVsZWdyYXBoLmNvbS91cGxvYWRzLzIwMjEtMDgvOWIwOTIwY2QtNmFlMi00ZTg0LThiNjQtNWY3ZjFmY2E0NjU2LmpwZw==.jpg
"Bitcoin surges towards $52K, reaching highest level since May",RT,"The price of the world’s most popular cryptocurrency, bitcoin, has continued to rise on Monday, after topping $50,000 the previous day. The digital asset is up 81% from this year’s low of $27,734 on January 4. Read Full Article at RT.com","Bitcoin was trading at $51,843 per coin as of 08:00 GMT, up almost 4%. 
Some experts say that the test will be for the cryptocurrency to remain above $51,000, which will give the market a better ide… [+958 chars]",2021-09-06,https://www.rt.com/business/534038-bitcoin-growth-highest-level/,https://cdni.rt.com/files/2021.09/article/6135d71585f5400467190c41.jpg
This Surging Cryptocurrency Just Overtook Dogecoin,Investor's Business Daily,"The Solana price surge lifted Bitcoin stocks such as Coinbase and Marathon Digital as well. SOL's price rally came in the wake of ""Ignition.""","A Solana price surge Friday sent it to a new high and put its market value above Dogecoin's, making SOL the seventh biggest cryptocurrency.
XBy midday, the Solana price was up 12% to $140.50, after … [+1479 chars]",2021-09-03,https://www.investors.com/news/this-surging-cryptocurrency-just-overtook-dogecoin/,https://www.investors.com/wp-content/uploads/2021/09/Stock-solana-01-adobe.jpg
BTC Markets taps licensed neobank Volt for integrated banking features,Cointelegraph,Fintech companies see an opportunity in the negligence and reluctance of traditional banks toward the cryptocurrency ecosystem.,"The banking capabilities of fintech have met cryptocurrencies in a new partnership between Australian crypto exchange BTC Markets and local neobank Volt.
With a license to operate in Australia as an… [+1698 chars]",2021-09-06,https://cointelegraph.com/news/btc-markets-taps-licensed-neobank-volt-for-integrated-banking-features,https://images.cointelegraph.com/images/1200_aHR0cHM6Ly9zMy5jb2ludGVsZWdyYXBoLmNvbS91cGxvYWRzLzIwMjEtMDkvNGNlNGY4MGUtZTM3MS00MjExLWJkNjYtMWI5NTdkNDNhYWZmLmpwZw==.jpg
China Bans “Sissy Men” from Television,Consequence.net,"China has announced that effeminate men are banned from TV. This homophobic crackdown is part of a broad “national rejuvenation"" initiative.","China has announced that effeminate men are banned from television. This homophobic crackdown is being touted as a “national rejuvenation,” according to Deadline, as state TV regulators call to “reso… [+844 chars]",2021-09-03,http://consequence.net/2021/09/china-bans-effeminate-men-tv/,https://consequence.net/wp-content/uploads/2021/09/china-bans-effeminate-men.jpg?quality=80
Binance Africa Responds to Warning Published by South African Financial Regulators,Yahoo Entertainment,"Binance reacted and responded to a notice published by the South African (FSCA), warning users to be vigilant when dealing with “Binance Group.”","BeInCrypto 
Binance reacted and responded to a notice published by the South African Financial Sector Conduct Authority (FSCA) on Sept 3, 2021, warning users to be vigilant when dealing with the cry… [+731 chars]",2021-09-05,https://finance.yahoo.com/news/binance-africa-responds-warning-published-104518378.html,https://s.yimg.com/uu/api/res/1.2/B4ofvOi0tam_Xg4GHzy9sg--~B/aD03MjA7dz0xMjAwO2FwcGlkPXl0YWNoeW9u/https://media.zenfs.com/en/beincrypto_articles_718/b673405da9da3abb09b9026371e3f731
"Regulating crypto could give it 'halo' of legitimacy, says UK watchdog",Cointelegraph,The chair of the United Kingdom's Financial Conduct Authority has warned that overextending the reach of regulators could backfire in the case of some cryptocurrency tokens.,"Regulators must step up protections for consumers who invest in crypto tokens but also keep in mind that overreach could backfire, the chair of the United Kingdoms Financial Conduct Authority (FCA) h… [+3372 chars]",2021-09-06,https://cointelegraph.com/news/regulating-crypto-could-give-it-halo-of-legitimacy-says-uk-watchdog,https://images.cointelegraph.com/images/1200_aHR0cHM6Ly9zMy5jb2ludGVsZWdyYXBoLmNvbS91cGxvYWRzLzIwMjEtMDkvZDI0ZTVlZTEtMTIyZC00MDliLTkzYzMtNDJjMTcwM2UxYTFmLmpwZw==.jpg
"Crypto and blockchain jobs' share grew 118% in ten months, new data shows",Cointelegraph,"Not only has demand for cryptocurrency- and blockchain-related expertise increased, but new data suggests that the kinds of roles being posted have shifted over time.",A new report gathering together the most recent data on the cryptocurrency and blockchain job market has suggested that higher levels of institutional adoption have spurred ever greater demand for ex… [+2233 chars],2021-09-03,https://cointelegraph.com/news/crypto-and-blockchain-jobs-share-grew-118-in-ten-months-new-data-shows,https://images.cointelegraph.com/images/1200_aHR0cHM6Ly9zMy5jb2ludGVsZWdyYXBoLmNvbS91cGxvYWRzLzIwMjEtMDkvMTM2NmQwNWYtZjc4NS00NzZiLTgxN2ItYTQwNjUzM2M1MDVjLmpwZw==.jpg
Hisham Chaudhary: Oadby terrorist who funded IS with Bitcoin jailed,BBC News,"Hisham Chaudhary used Bitcoin to free IS supporters from detention camps, police say.","image sourceCounter Terrorism Policing North East
image captionHisham Chaudhary was found guilty of seven offences under the Terrorism Act
A man who funded the Islamic State (IS) group using Bitcoi… [+2300 chars]",2021-09-03,https://www.bbc.co.uk/news/uk-england-leicestershire-58439085,https://ichef.bbci.co.uk/news/1024/branded_news/70AD/production/_119254882_c1f679f3-449d-4597-b075-5ae391f4df55.jpg
"Why Solana, Polkadot, and Chainlink Are All Up This Week",Motley Fool,These blockchain tokens are rapidly revolutionizing the world of finance.,"What happened 
Solana(CRYPTO:SOL), Polkadot(CRYPTO:DOT), and Chainlink(CRYPTO:LINK) are up 69.78%, 27.65%, and 20.77%, respectively, in the past seven days. They are now trading at a respective $139… [+3172 chars]",2021-09-03,https://www.fool.com/investing/2021/09/03/why-solana-polkadot-and-chainlink-are-all-up-this/,https://g.foolcdn.com/editorial/images/641954/skyscrapers-emerging-from-blockchains-getty-images.jpg
"An investor's guide to Cardano, which has mysteriously become the No. 3 crypto in the world",CNBC,"Cardano's ada token just hit an all-time high, but how it became the third-largest cryptocurrency is a mystery to some.","The Cardano blockchain's ada token, the third largest cryptocurrency by market capitalization, according to CoinGecko, hit an all-time high Thursday of $3.09, after breaking past $3 on Wednesday.
Th… [+388 chars]",2021-09-04,https://www.cnbc.com/2021/09/04/an-investors-guide-to-cardano-which-has-mysteriously-become-the-no-3-crypto-in-the-world.html,https://image.cnbcfm.com/api/v1/image/104893407-GettyImages-885948316.jpg?v=1532563713
"Data: Eastern Europe emerges as hotbed of crypto scams, costing investors millions",Yahoo Entertainment,"A little known crypto scam made up half of all illicit crypto transactions in Eastern Europe over the past year, costing investors hundreds of millions.","Eastern Europe has become a hotbed for cryptocurrency scams, according to a new analysis, with addresses in the region having a high rate of exposure to illicit transactions second to only Africa. 
… [+7488 chars]",2021-09-03,https://finance.yahoo.com/news/eastern-europe-emerges-as-hotbed-of-crypto-scams-costing-investors-millions-191952314.html,https://s.yimg.com/os/creatr-uploaded-images/2021-09/b0e425e0-0ad0-11ec-bff9-3488446f396d
Forex Brokers Reviews | Forex Reviews | Forex Comparison,Visual.ly,Forex brokers comparison is an industry-leading ultimate platform with the aim to provide forex traders resources like Forex Broker Reviews and Compar,Forex Broker Comparison Forex brokers comparison is the ultimate platform with the aim to provide forex traders resources like BEST FOREX BROKERS FX BROKERS BY COUNTRY Forex Trading is one of the mos… [+2590 chars],2021-09-06,https://visual.ly/community/Infographics/business/forex-brokers-reviews-forex-reviews-forex-comparison,http://thumbnails-visually.netdna-ssl.com/forex-brokers-reviews--forex-reviews--forex-comparison_613600574206c_w250_h250.jpg
Argo Blockchain Provides August Operational Update,Business Wire,"LONDON--(BUSINESS WIRE)--Argo Blockchain plc (LSE: ARB; OTCQX: ARBKF), (“Argo” or the “Company”), a global leader in sustainable blockchain infrastructure and cryptocurrency mining, is pleased to provide the following operational update for August. During the…","LONDON--(BUSINESS WIRE)--Argo Blockchain plc (LSE: ARB; OTCQX: ARBKF), (Argo or the Company), a global leader in sustainable blockchain infrastructure and cryptocurrency mining, is pleased to provide… [+1753 chars]",2021-09-03,https://www.businesswire.com/news/home/20210903005075/en/Argo-Blockchain-Provides-August-Operational-Update,http://www.businesswire.com/images/bwlogo_square.png
CryptoCodex: Crypto Price ‘Extreme’ Greed As Bitcoin Gears Up For A Big Week And An NFT Bombshell,Forbes,The following is an excerpt from the daily CryptoCodex email newsletter. Sign up now for free here...,"The following is an excerpt from the daily CryptoCodex email newsletter. Sign up now for free here
Greed is good
The cryptocurrency market has stormed into the new month, with expectations high tha… [+5249 chars]",2021-09-06,https://www.forbes.com/sites/billybambrough/2021/09/06/cryptocodex-crypto-price-extreme-greed-as-bitcoin-gears-up-for-a-big-week-and-an-nft-bombshell/,https://thumbor.forbes.com/thumbor/fit-in/1200x0/filters%3Aformat%28jpg%29/https%3A%2F%2Fspecials-images.forbesimg.com%2Fimageserve%2F6135fbd9fa62d99c64059a14%2F0x0.jpg%3FcropX1%3D0%26cropX2%3D3783%26cropY1%3D192%26cropY2%3D2320
Direct Threat To 80% Of Revenue Translates To 7% Decline In Robinhood Shares,Dealbreaker,"Makes as much sense as any of the rest of it, no?","Robinhood was pretty eager to go public, and you can understand why. In little more than a decade, it had become the go-to app for the millennial trader, as underlined by its role in the great meme-s… [+2411 chars]",2021-09-03,https://dealbreaker.com/2021/08/gensler-may-ban-pfof,https://dealbreaker.com/.image/t_share/MTc0MTQ3Mjg3MzMxNjQ0NzAx/robinhood.jpg
"Understanding Bitcoin, Ready or Not",Dailyinfographic.com,"Cryptocurrencies are all the craze. If you’re like me, you might still be trying to wrap your head around the whole concept. I can barely keep a hold of my cash and debit card– and now there are a plethora of different currencies popping up and taking the fin…","By Alexis|source:HereSep 3rd, 2021Cryptocurrencies are all the craze. If youre like me, you might still be trying to wrap your head around the whole concept. I can barely keep a hold of my cash and d… [+1439 chars]",2021-09-03,https://dailyinfographic.com/understanding-bitcoin-ready-or-not,https://dailyinfographic.com/wp-content/uploads/2021/06/bitcoin-infographic.png
Bitcoin news – live: Fresh price surge sees BTC lead crypto market to 4-month high,Independent,"Bitcoin has surged once again over the weekend, taking its price above $51,000 on Monday morning.","Bitcoin has surged once again over the weekend, taking its price above $51,000 on Monday morning.
The latest gains have been mirrored by other leading cryptocurrencies, including Ethereum (ether) an… [+1624 chars]",2021-09-06,https://www.independent.co.uk/life-style/gadgets-and-tech/bitcoin-news-live-price-btc-ethereum-b1914875.html,https://static.independent.co.uk/2021/09/06/09/bitcoin%20price%20latest%20record%202021.jpg?width=1200&auto=webp&quality=75
The Crypto Opportunity,Motley Fool,This episode features a session from our member event!,"Motley Fool Germany analyst Bernd Schmid walks host Kate Herman through his outlook on crypto -- the opportunity, the most interesting applications, and how to tell pretenders from contenders as inve… [+28977 chars]",2021-09-03,https://www.fool.com/investing/2021/09/03/the-crypto-opportunity/,https://g.foolcdn.com/editorial/images/641463/cover_if.jpg
"17% of Australians now own crypto, totaling $8B between them: Survey",Cointelegraph,"One in six Australians own Bitcoin, Ethereum, Dogecoin and other cryptocurrencies, according to a recent survey from June 2021. Total value of their holdings: $8B.","One in six Australians now own cryptocurrency, with the total value of their holdings adding up to $8 billion, according to a recent survey. 
The full report of the Finder Consumer Sentiment Tracker… [+2533 chars]",2021-09-03,https://cointelegraph.com/news/17-of-australians-now-own-crypto-totaling-8b-between-them-survey,https://images.cointelegraph.com/images/1200_aHR0cHM6Ly9zMy5jb2ludGVsZWdyYXBoLmNvbS91cGxvYWRzLzIwMjEtMDkvYjQ3MDhlN2QtODIxYy00ODYyLTllNmQtNjQ5OGVkYzYzYmMwLmpwZw==.jpg
"Yes, you can book travel with bitcoin and other cryptocurrency – but should you?",USA Today,There are advantages and disadvantages to using a digital currency to pay for travel expenses – and one benefit that almost no one is talking about.,"Troy Wiipongwii, the director of the William &amp; Mary Blockchain Lab, has paid for several flights and hotels with cryptocurrency. Most recently, he booked a flight from Newark to Toronto on Air Ca… [+7051 chars]",2021-09-03,https://www.usatoday.com/story/travel/advice/2021/09/03/should-you-pay-for-travel-with-bitcoin-cryptocurrency/5668195001/,https://www.gannett-cdn.com/-mm-/ea23014f505bc108b41d312aad6cff6792a064c3/c=0-0-2308-1298/local/-/media/2021/07/01/USATODAY/usatsports/MotleyFool-TMOT-70aee22e-415555d2.jpg?auto=webp&format=pjpg&width=1200
As El Salvador Makes Cryptocurrency Legal Tender is It the Beginning of the End for Dollar Hegemony?,Sputnik International,"The idea of cryptocurrency was first conceived in the 1980s but it was not until 2009 that the first open-sourced software, Bitcoin, was released. There are now dozens of blockchains but they have until not been regarded as legal tender.","The idea of cryptocurrency was first conceived in the 1980s but it was not until 2009 that the first open-sourced software, Bitcoin, was released. There are now dozens of blockchains but they have un… [+3340 chars]",2021-09-06,https://sputniknews.com/business/202109061083808452-as-el-salvador-makes-cryptocurrency-legal-tender-is-it-the-beginning-of-the-end-for-dollar-hegemony/,https://cdn2.img.sputniknews.com/images/07e5/05/13/1082941161.jpg
What August's record breaking month for crypto flows means for bitcoin,Yahoo Entertainment,"The crypto market looked like a rising tide for all coins last month, but growth across the asset class hasn’t been equal.","Over the past month, the crypto market has looked like a rising tide for all coins but data suggest growth across the asset class hasnt been equal.
Last week, Bitcoin (BTC-USD) breached $50,000 for … [+4524 chars]",2021-09-05,https://finance.yahoo.com/news/what-augusts-record-breaking-month-for-crypto-flows-means-for-bitcoin-163906276.html,https://s.yimg.com/ny/api/res/1.2/WaQA8H0nRJznxz8mPEuO_A--/YXBwaWQ9aGlnaGxhbmRlcjt3PTEyMDA7aD04MDA-/https://s.yimg.com/os/creatr-uploaded-images/2021-08/8405c810-feb1-11eb-9d7d-0bc7b61823aa
Binance to Halt Singapore Products After Central Bank Warning,Yahoo Entertainment,(Bloomberg) -- Cryptocurrency exchange Binance said on Sunday that it will stop offering some products in Singapore after regulators said earlier in the week...,(Bloomberg) -- Cryptocurrency exchange Binance said on Sunday that it will stop offering some products in Singapore after regulators said earlier in the week that the company may be in breach of the … [+1672 chars],2021-09-05,https://finance.yahoo.com/news/binance-halt-singapore-products-central-124748029.html,https://s.yimg.com/ny/api/res/1.2/.73w9DQOAXg3vZGcauhkYg--/YXBwaWQ9aGlnaGxhbmRlcjt3PTEyMDA7aD04MDE-/https://s.yimg.com/uu/api/res/1.2/8erkt4miw8OiyPbhNH.sLg--~B/aD0xMzM1O3c9MjAwMDthcHBpZD15dGFjaHlvbg--/https://media.zenfs.com/en/bloomberg_markets_842/7b0d20b749007c8038cc840594cc2e88
Sen. Elizabeth Warren calls crypto the ‘new shadow bank‘,Cointelegraph,The total market capitalization of stablecoins like Tether and USDC Coin has jumped from around $37 billion in January to $123 billion in September.,"United States Senator Elizabeth Warren, one of the most vocal cryptocurrency skeptics in the U.S. government, has called the cryptocurrency industry the new shadow bank.
In a Sept. 5 interview with … [+1627 chars]",2021-09-06,https://cointelegraph.com/news/sen-elizabeth-warren-calls-crypto-the-new-shadow-bank,https://images.cointelegraph.com/images/1200_aHR0cHM6Ly9zMy5jb2ludGVsZWdyYXBoLmNvbS91cGxvYWRzLzIwMjEtMDkvOTkyMDBjZTItYzA2MC00ZmNlLWFlYmMtNGFlYTRhYjQ0NTc3LmpwZw==.jpg
