title,source,description,content,pub_date,url,photo_url
Revolut valuation makes little sense when compared with Lloyds | Nils Pratley,The Guardian,"How can this six-year-old fintech firm be worth £24bn, supposedly 70% of Lloyds’ stock market value?It is “great news”, said Rishi Sunak, performing his ra-ra routine for the UK’s fintech sector, that Revolut has raised another $800m (£566m) to fund expansion…","It is great news, said Rishi Sunak, performing his ra-ra routine for the UKs fintech sector, that Revolut has raised another $800m (£566m) to fund expansion. And it is: more capital and bold investor… [+4089 chars]",2021-07-15,https://amp.theguardian.com/business/nils-pratley-on-finance/2021/jul/15/revolut-valuation-makes-little-sense-compared-lloyds,https://i.guim.co.uk/img/media/276bb0e0774824208bd5c4ade4ceb6abbdf706c7/74_119_3330_1998/master/3330.jpg?width=1200&height=630&quality=85&auto=format&fit=crop&overlay-align=bottom%2Cleft&overlay-width=100p&overlay-base64=L2ltZy9zdGF0aWMvb3ZlcmxheXMvdGctb3BpbmlvbnMucG5n&enable=upscale&s=7a24f86eefd75149fb609ec5b1d220e2
Why are so many Americans happy with their lot?,The Guardian,A survey paints a different picture of the US – plus all the week’s reasons to be hopefulThere were two surprising things about a recent Gallup survey into life satisfaction in the US.The first was that more Americans consider themselves to be thriving that a…,"There were two surprising things about a recent Gallup survey into life satisfaction in the US.
The first was that more Americans consider themselves to be thriving that at any point for more than a… [+4860 chars]",2021-07-16,https://amp.theguardian.com/world/2021/jul/16/why-so-many-americans-happy-with-their-lot-survey,https://i.guim.co.uk/img/media/595363e75e085b622e1c1f083622a9f402e92e51/0_190_5700_3420/master/5700.jpg?width=1200&height=630&quality=85&auto=format&fit=crop&overlay-align=bottom%2Cleft&overlay-width=100p&overlay-base64=L2ltZy9zdGF0aWMvb3ZlcmxheXMvdGctZGVmYXVsdC5wbmc&enable=upscale&s=a3f1802f4d2c2b32100c3ec561e79cd6
Ukraine warehouse packed with thousands of PS4s was actually a FIFA Ultimate Team bot farm,Eurogamer.net,A giant cryptocurrency farm in Ukraine that contained thousands of PlayStation 4 consoles was actually a FIFA bot farm.Last week the Security Service of Ukraine (SBU) announced it had shut down what was reported as a cryptocurrency mining farm that contained …,"A giant cryptocurrency farm in Ukraine that contained thousands of PlayStation 4 consoles was actually a FIFA bot farm.
Last week the Security Service of Ukraine (SBU) announced it had shut down wha… [+2316 chars]",2021-07-17,https://www.eurogamer.net/articles/2021-07-17-ukraine-warehouse-packed-with-thousands-of-ps4s-was-actually-a-fifa-ultimate-team-bot-farm,https://d2skuhm0vrry40.cloudfront.net/2021/articles/2021-07-17-11-29/-1626517786055.jpg/EG11/resize/1200x-1/-1626517786055.jpg
3 Secrets to Successful Crypto Investing,Motley Fool,What to do if you plan on buying cryptocurrency.,Investing in cryptocurrencies might be enticing -- especially when you hear stories of people being catapulted into millionaire status almost overnight. But these types of investments are complicated… [+4214 chars],2021-07-15,https://www.fool.com/investing/2021/07/15/3-secrets-to-successful-crypto-investing/,https://g.foolcdn.com/editorial/images/631047/gettyimages-924528132.jpg
$10 million rewards bolster White House anti-ransomware bid,ABC News,"The Biden administration will offer rewards up to $10 million for information leading to the identification of foreign state-sanctioned malicious cyber activity against critical U.S. infrastructure, including ransomware attacks",BOSTON -- The Biden administration will offer rewards up to $10 million for information leading to the identification of foreign state-sanctioned malicious cyber activity against critical U.S. infras… [+2184 chars],2021-07-15,https://abcnews.go.com/Politics/wireStory/10-million-rewards-bolster-white-house-anti-ransomware-78858887,https://s.abcnews.com/images/Politics/WireAP_83fa884a652441f59467072488b7b17b_16x9_992.jpg
"Forget Dogecoin, These Tech Stocks Are Better Buys Right Now",Motley Fool,These tech stocks are on track for more predictable gains than the cryptocurrency.,Cryptocurrency Dogecoin (CRYPTO:DOGE) has lost more than 70% of its value since early May. This recent performance serves as yet another reminder of how buying into hype can leave investors holding t… [+3876 chars],2021-07-17,https://www.fool.com/investing/2021/07/17/forget-dogecoin-these-tech-stocks-are-better-buys/,https://g.foolcdn.com/editorial/images/633548/gettyimages-1271693972.jpg
Apple Is Rumored To Have Bought $2.5 Billion USD Worth of Bitcoin,HYPEBEAST,Twitter has been heating up over a recent rumor that Apple will soon announce that the global tech company has gotten back into the bitcoin pool with a recent $2.5 billion USD purchase of the cryptocurrency.Amongst the Twitter accounts pushing this rumor is G…,Twitter has been heating up over a recent rumor that Apple will soon announce that the global tech company has gotten back into the bitcoin pool with a recent $2.5 billion USD purchase of the cryptoc… [+1035 chars],2021-07-15,https://hypebeast.com/2021/7/apple-bought-2-5-billion-usd-bitcoin-rumors,https://image-cdn.hypb.st/https%3A%2F%2Fhypebeast.com%2Fimage%2F2021%2F07%2Fapple-bought-2-5-billion-usd-bitcoin-news-tw.jpg?w=960&cbr=1&q=90&fit=max
What's the Best Cryptocurrency to Invest in Right Now?,Motley Fool,There are several different cryptocurrencies to choose from. Which one is right for you?,"Cryptocurrencies have had a whirlwind of a year so far. Between reaching record-breaking highs and then crashing a few months later, they've experienced a roller coaster of ups and downs.
Many of th… [+4387 chars]",2021-07-16,https://www.fool.com/investing/2021/07/16/whats-the-best-cryptocurrency-to-invest-in-right-n/,https://g.foolcdn.com/editorial/images/633618/bitcoin-symbol.jpg
Extra Extra: Spike Lee's Cryptocurrency Commercial Is Here,Gothamist,"Because Spike Lee is done with dollars, here are your late day links: Taco Bell price hike, big dogs, Le Fou's coming out story (?), A.O. Scott wonders what even are movies now, and more. [ more › ]","Gothamist is a website about New York City news, arts and events, and food, brought to you by New York Public Radio.",2021-07-15,http://gothamist.com/news/extra-extra-spike-lees-cryptocurrency-commercial-here,https://cms.prod.nypr.digital/images/322104/fill-1200x650/
Ripple Labs Can Question Former SEC Official in Suit Over XRP,Bloomberg,"Ripple Labs Inc. can question a former Securities and Exchange Commission official about the agency’s policy decisions as the company fights a lawsuit accusing it of misleading investors about its XRP cryptocurrency, a federal judge ruled.",Ripple Labs Inc. can question a former Securities and Exchange Commission official about the agencys policy decisions as the company fights a lawsuit accusing it of misleading investors about its XRP… [+2910 chars],2021-07-15,https://www.bloomberg.com/news/articles/2021-07-15/ripple-labs-can-question-former-sec-official-in-suit-over-xrp,https://assets.bwbx.io/images/users/iqjWHBFdfxIU/iCXAV1pQTzjc/v0/1200x800.jpg
Netflix Hires a Former EA Exec and Damien Hirst Drops His First NFTs in This Week’s Business and Crypto Roundup,HYPEBEAST,"Many brands are starting to see a recovery despite the challenges initially brought on by the pandemic. Some businesses, especially ones that focused efforts on expanding e-commerce ventures, have even seen profits rise even higher than before.HYPEBEAST has r…","Many brands are starting to see a recovery despite the challenges initially brought on by the pandemic. Some businesses, especially ones that focused efforts on expanding e-commerce ventures, have ev… [+3567 chars]",2021-07-17,https://hypebeast.com/2021/7/business-and-crypto-here-are-our-top-stories-of-the-week-july-16,https://image-cdn.hypb.st/https%3A%2F%2Fhypebeast.com%2Fimage%2F2021%2F07%2FNetflix-Hires-a-Former-EA-Exec-and-Damien-Hirst-Drops-His-First-NFTs-in-This-Week%E2%80%99s-Business-and-Crypto-Roundup-tw.jpg?w=960&cbr=1&q=90&fit=max
"Dogecoin Co-Creator Says Crypto Is 'Right-Wing, Hyper Capitalist'",Vice News,Jackson Palmer published a long Twitter thread that explains everything wrong with cryptocurrency.,"Jackson Palmer, the Australian co-creator of Dogecoin, hasn't had much of an online presence for years since decrying his own creation as being an example of everything wrong with cryptocurrency as i… [+3571 chars]",2021-07-15,https://www.vice.com/en/article/k78pxv/dogecoin-co-creator-says-crypto-is-right-wing-hyper-capitalist,https://video-images.vice.com/articles/60f044e04d0ce9009b43b843/lede/1626359240549-gettyimages-1233884508.jpeg?image-resize-opts=Y3JvcD0xeHc6MC44MDU4eGg7MHh3LDAuMTU5eGgmcmVzaXplPTEyMDA6KiZyZXNpemU9MTIwMDoq
Here Are the Potential Emojis Coming With Unicode 14.0,HYPEBEAST,"Ahead of World Emoji Day (July 17), Emojipedia has revealed the potential emoji additions coming with Unicode 14.0.Set to be finalized in September by Unicode Consortium, once again the range is centered around diversity and inclusivity. Some notable emojis i…","Ahead of World Emoji Day (July 17), Emojipedia has revealed the potential emoji additions coming with Unicode 14.0.
Set to be finalized in September by Unicode Consortium, once again the range is ce… [+695 chars]",2021-07-16,https://hypebeast.com/2021/7/unicode-14-0-potential-emoji-reveal-info,https://image-cdn.hypb.st/https%3A%2F%2Fhypebeast.com%2Fimage%2F2021%2F07%2Funicode-14-0-potential-emoji-reveal-info-tw.jpg?w=960&cbr=1&q=90&fit=max
"Why Bitcoin, Dogecoin, and Etherium Crashed Today",Motley Fool,Cryptocurrency's newest critic is...Dogecoin's creator.,"What happened
Cryptocurrencies are under attack Thursday -- and it was an inside job. On Twitter yesterday, Dogecoin co-creator Jackson Palmer launched a broadside attack on cryptocurrencies in gene… [+2659 chars]",2021-07-15,https://www.fool.com/investing/2021/07/15/why-bitcoin-dogecoin-and-etherium-crashed-today/,https://g.foolcdn.com/editorial/images/633790/round-bitcoin-overlaid-on-a-falling-stock-chart.jpg
How To Profit From Bitcoin Funds,Forbes,Price discrepancies crop up on cryptocurrency trusts. It pays to understand them.,"Price discrepancies crop up on cryptocurrency trusts. It pays to understand them.
Grayscale share price
Forbes
Bitcoins worth $2.5 billion are lying on the sidewalk. Whos going to pick them up?
G… [+7856 chars]",2021-07-18,https://www.forbes.com/sites/baldwin/2021/07/18/how-to-profit-from-bitcoin-funds/,https://thumbor.forbes.com/thumbor/fit-in/1200x0/filters%3Aformat%28jpg%29/https%3A%2F%2Fspecials-images.forbesimg.com%2Fimageserve%2F60f3647b1a49a384a7092d1a%2F0x0.jpg
"PayPal Increases Cryptocurrency Purchase Limit To $100,000 Per Week",Forbes,"Payments firm PayPal has lifted the weekly crypto payments limit to $100,000 worth of digital assets after launching crypto services in October 2020.","UKRAINE - 2021/04/30: In this photo illustration, PayPal logo is seen displayed on a smartphone ... [+] screen in front of cryptocurrency signs. (Photo Illustration by Pavlo Gonchar/SOPA Images/Light… [+1498 chars]",2021-07-15,https://www.forbes.com/sites/emilymason/2021/07/15/paypal-increases-cryptocurrency-purchase-limit-to-100000-per-week/,https://thumbor.forbes.com/thumbor/fit-in/1200x0/filters%3Aformat%28jpg%29/https%3A%2F%2Fspecials-images.forbesimg.com%2Fimageserve%2F60f08fd6b41da7c1ba68e4c6%2F0x0.jpg
"Police Destroy 1,069 Bitcoin Miners With Big Ass Steamroller In Malaysia",Vice News,Malaysian authorities did not mess around when they broke up a cryptocurrency mining farm and charged the operators with stealing electricity.,"As Bitcoin’s price surged this spring to a new all-time high, the spotlight shining on its controversial mining process only got brighter. Bitcoin, Ethereum, and many other cryptocurrencies use an en… [+4743 chars]",2021-07-16,https://www.vice.com/en/article/7kv739/police-destroy-1069-bitcoin-miners-with-big-ass-steamroller-in-malaysia,https://video-images.vice.com/articles/60f1d0701ce5ea0094ce260f/lede/1626460485663-screenshot-19.png?image-resize-opts=Y3JvcD0wLjgzMjh4dzowLjgzMjR4aDswLjAyOTJ4dywwLjA4MzN4aCZyZXNpemU9MTIwMDoqJnJlc2l6ZT0xMjAwOio
Paraguay unveils new cryptocurrency law,Yahoo Entertainment,"After a month of anticipation, the finalised details of Paraguay’s new crypto legislation have been revealed as the country moves to become a key player in...","After a month of anticipation, the finalised details of Paraguay’s new crypto legislation have been revealed as the country moves to become a key player in Latin America’s unfolding crypto race.
The… [+3548 chars]",2021-07-16,https://finance.yahoo.com/news/paraguay-unveils-cryptocurrency-law-143911714.html,https://s.yimg.com/uu/api/res/1.2/XMVq4kvZz_jD_80JPq8vMA--~B/aD02Njc7dz0xMDAwO2FwcGlkPXl0YWNoeW9u/https://media.zenfs.com/en/coin_rivet_596/f82246561557fba1541b5ba976802d67
Ethereum's History: From Zero To 2.0,Seeking Alpha,"Ethereum is now the second-largest cryptocurrency by market capitalization, accounting for approximately 18% of the cryptocurrency market.","da-kuk/E+ via Getty Images
By Jianing Wu
 Vitalik Buterin came up with the idea of Ethereum in 2013 at the age of 19. Later that year, he published a white paper describing Ethereum as ""a next-gene… [+11495 chars]",2021-07-16,https://seekingalpha.com/article/4439570-ethereum-history-from-zero-to-2-0,https://static.seekingalpha.com/cdn/s3/uploads/getty_images/1297465792/large_image_1297465792.jpg
"Cryptocurrency Mining Farm Discovered Using 3,800 PS4 Consoles",Ubergizmo,"Buying cryptocurrency for investment might not be the best idea because of how expensive it can be, and due to the ever-fluctuating prices. Ideally, mining for it yourself could be a more cost-effective solution if you can scale up your operations, which is w…","Image credit – Security Service of Ukraine
Buying cryptocurrency for investment might not be the best idea because of how expensive it can be, and due to the ever-fluctuating prices. Ideally, mining… [+1191 chars]",2021-07-15,https://www.ubergizmo.com/2021/07/crypto-mining-farm-3800-ps4/,https://i0.wp.com/cdnssl.ubergizmo.com/wp-content/uploads/2021/07/crypto-farm.jpg
Blockchain and Cryptocurrency,Visual.ly,"Blockchain and Cryptocurrency as it is the most emerging technology in the IT and finance industries.

A Cryptocurrency is a digital, encrypted, and d","Overview of Cryptocurrency A cryptocurrency is a digital, encrypted, and decentralized medium of trade that can be administered without the use of a central bank, eliminating worries about secrecy an… [+757 chars]",2021-07-15,https://visual.ly/community/Infographics/technology/blockchain-and-cryptocurrency,https://thumbnails-visually.netdna-ssl.com/blockchain-and-cryptocurrency_60f01f504840f_w250_h250.jpg
Clubhouse Now Enables Text-Based DM Feature,HYPEBEAST,"Clubhouse will now let users have one-on-one or group chat via direct messages. Since its explosive growth, this will be the first time the social audio app will bring on a text-based communication system.All iOS and Android users can now use the Backchannel …","Clubhouse will now let users have one-on-one or group chat via direct messages. Since its explosive growth, this will be the first time the social audio app will bring on a text-based communication s… [+927 chars]",2021-07-16,https://hypebeast.com/2021/7/clubhouse-dm-backchannel-update-message-info,https://image-cdn.hypb.st/https%3A%2F%2Fhypebeast.com%2Fimage%2F2021%2F07%2Fclubhouse-dm-backchannel-update-message-info-tw.jpg?w=960&cbr=1&q=90&fit=max
‘Never Said The Word Sell’—Elon Musk Boosts The Price Of Dogecoin As Bitcoin And Crypto Lose Billions,Forbes,"Elon Musk, the dogecoin-touting Tesla billionare, has boosted the price of the meme-based cryptocurrency, tweeting his son is ""holding his doge like a champ""...","Elon Musk, the dogecoin-touting Tesla billionaire, has boosted the price of the meme-based cryptocurrency, tweeting his son is ""holding his doge like a champ.""
The dogecoin price, down around 75% fr… [+2728 chars]",2021-07-17,https://www.forbes.com/sites/billybambrough/2021/07/17/never-said-the-word-sell-elon-musk-boosts-the-price-of-dogecoin-as-bitcoin-and-crypto-lose-billions/,https://thumbor.forbes.com/thumbor/fit-in/1200x0/filters%3Aformat%28jpg%29/https%3A%2F%2Fspecials-images.forbesimg.com%2Fimageserve%2F60f310f2a6f63149f1bdea56%2F0x0.jpg
Warning: The FBI Has Issued A Serious Bitcoin And Crypto Alert,Forbes,"The FBI has warned bitcoin and cryptocurrency buyers, exchanges and payment platforms over the growing threat of criminals looking to steal bitcoin and crypto-assets...","Soaring bitcoin and cryptocurrency prices this year, making crypto a more-than-$1 trillion market, have attracted a wave of cyber criminals.
Bitcoin-demanding ransomware attacks and social media-bas… [+3682 chars]",2021-07-15,https://www.forbes.com/sites/billybambrough/2021/07/14/the-fbi-has-issued-a-serious-bitcoin-and-crypto-alert-warning/,https://thumbor.forbes.com/thumbor/fit-in/1200x0/filters%3Aformat%28jpg%29/https%3A%2F%2Fspecials-images.forbesimg.com%2Fimageserve%2F60ef255965621e686ef50570%2F0x0.jpg
"Why MicroStrategy, Coinbase, and Riot Blockchain Stocks All Fell This Week",Motley Fool,"The general populace seems to be loosing interest in crypto, whereas cries for crypto regulation are rising.","What happened
Cryptocurrency stocks like MicroStrategy(NASDAQ:MSTR), CoinbaseGlobal(NASDAQ:COIN), and RiotBlockchain(NASDAQ:RIOT) all pulled back during the past week. As of the market close on Thur… [+4501 chars]",2021-07-16,https://www.fool.com/investing/2021/07/16/why-microstrategy-coinbase-and-riot-blockchain-sto/,https://g.foolcdn.com/editorial/images/633819/a-frustrated-woman-closes-eyes-in-front-of-laptop.jpg
Amazon Just Got Approved To Monitor You While You’re Asleep,HYPEBEAST,The Federal Communications Commission this month granted Amazon the rights to use a radar sensor to improve sleep tracking on its smart devices. But a new column in the The Los Angeles Times explores the implications of this decision and what it means for use…,The Federal Communications Commission this month granted Amazon the rights to use a radar sensor to improve sleep tracking on its smart devices. But a new column in the The Los Angeles Times explores… [+1548 chars],2021-07-17,https://hypebeast.com/2021/7/amazon-sleep-monitoring-sensor,https://image-cdn.hypb.st/https%3A%2F%2Fhypebeast.com%2Fimage%2F2021%2F07%2Famazon-sleep-monitoring-sensor-FCC-tw.jpg?w=960&cbr=1&q=90&fit=max
"Damien Hirst to Release First Set Of 10,000 Hand-Painted Works as NFTs",HYPEBEAST,"Damien Hirst has joined the NFT party with a collection set to release through art sales platform HENI.Dubbed ""The Currency,"" the drop consists of 10,000 hand-painted works of art, each with a corresponding NFT that you can apply for the chance to purchase. S…","Damien Hirst has joined the NFT party with a collection set to release through art sales platform HENI.
Dubbed “The Currency,” the drop consists of 10,000 hand-painted works of art, each with a corr… [+1411 chars]",2021-07-15,https://hypebeast.com/2021/7/damien-hirst-the-currency-nft-heni,https://image-cdn.hypb.st/https%3A%2F%2Fhypebeast.com%2Fimage%2F2021%2F07%2Fdamien-hirst-the-currency-nft-heni-tw.jpg?w=960&cbr=1&q=90&fit=max
Stocks Fall: Can Square Save Bitcoin?,Motley Fool,A big late-day decline revealed investor anxiety.,"The stock market has made a lot of progress so far in 2021, but market participants had to deal with a modest setback on Friday. Investors seemed to react negatively to worries about inflation on the… [+3358 chars]",2021-07-16,https://www.fool.com/investing/2021/07/16/stocks-fall-can-square-save-bitcoin/,https://g.foolcdn.com/editorial/images/634010/bitcoin-gettyimages-637337694.jpg
5 Penny Stocks Reddit Traders Are Buying On GameStop NFT Speculation,Penny Stocks,NFT Penny Stocks Rise To The Occassion Turning Heads On Reddit Today,"This story originally appeared on PennyStocksAre NFT Stocks Back In Action?
Penny stocks are well known for their speculative nature. Now, pair that with an industry or sector with just as much spec… [+8342 chars]",2021-07-15,https://pennystocks.com/featured/2021/07/15/5-penny-stocks-reddit-traders-buying-today-ride-nft-trend/,https://assets.entrepreneur.com/providers/pennystocks/hero-image-pennystocks-377453.jpeg
Former FaZe member threatens legal action against YouTubers who exposed his crypto scheme,PC Gamer,A cease-and-desist has been filed against Coffeezilla's investigation into the murky cryptocurrency launch.,"Two weeks back, former Faze member Frazier ""Kay"" Khattri was booted from the competitive gaming clan after he and three others were found pushing a shady ""pump and dump"" cryptocurrency scheme. Now, Y… [+2712 chars]",2021-07-15,https://www.pcgamer.com/former-faze-member-threatens-legal-action-against-youtubers-who-exposed-his-crypto-scheme/,https://cdn.mos.cms.futurecdn.net/fTSoMykKJxiqMeYLHo7med-1200-80.jpg
NVIDIA Stock Could Crash. Here's What You Should Do if It Does,Motley Fool,"As graphics card prices start sliding, NVIDIA investors may have to relive a torrid time in the company's history.",NVIDIA(NASDAQ:NVDA) has sizzled on the stock market since the beginning of 2019. Shares of the graphics specialist have jumped about 500% in just over two and a half years thanks to terrific growth i… [+4241 chars],2021-07-15,https://www.fool.com/investing/2021/07/15/nvidia-stock-could-crash-heres-what-you-should-do/,https://g.foolcdn.com/editorial/images/633359/gettyimagesgraphicscards.jpg
Spike Lee Made an Ad for Cryptocurrency ATMs and It's Bizarre,Vice News,"""Old money is out. New money is in.""","The latest attempt to push digital currency as the great equalizer comes from Spike Lee, who has directed a new commercial for Coin Cloud, a company that offers ATMs for cryptocurrencies. Yes, the Os… [+5844 chars]",2021-07-15,https://www.vice.com/en/article/dyvwkk/spike-lee-made-an-ad-for-cryptocurrency-atms-and-its-bizarre,https://video-images.vice.com/articles/60f06b40daac5e0094c20503/lede/1626368832607-save.png?image-resize-opts=Y3JvcD0wLjk4ODg4ODg4ODg4ODg4ODh4dzoxeGg7Y2VudGVyLGNlbnRlciZyZXNpemU9MTIwMDoqJnJlc2l6ZT0xMjAwOio
Bitcoin trades lower as Square creates a new business based on the cryptocurrency - Fox Business,Fox Business,Bitcoin trades lower as Square creates a new business based on the cryptocurrency  Fox Business,"Bitcoin
 was trading nearly 3% lower early Friday morning.
The price was around $31,470 per coin, while rivals Ethereum and Dogecoin
 were trading around $1,861 and 18 cents per coin, respectively… [+1454 chars]",2021-07-16,https://www.foxbusiness.com/markets/bitcoin-7-16,https://a57.foxnews.com/static.foxbusiness.com/foxbusiness.com/content/uploads/2020/12/0/0/Bitcoin-Gold.jpg?ve=1&tl=1
Thousands of PS4s Being Used As a FIFA Ultimate Team Bot Farm Seized by Ukrainian Police,IGN,Thousands of PS4s from a supposed cryptocurrency farm in Ukraine that were seized last week were actually being used to grind FIFA Ultimate Team for various accounts that would then be sold on the black market.,Thousands of PS4s from a supposed cryptocurrency farm in Ukraine that were seized last week were actually being used to grind FIFA Ultimate Team for various accounts that would then be sold on the bl… [+1952 chars],2021-07-18,https://www.ign.com/articles/thousands-of-ps4s-used-as-fifa-ultimate-team-bot-farm-ukrainian-police-seized,https://assets-prd.ignimgs.com/2021/07/18/fifa-1626585151117.png?width=1280
"Crypto Price Prediction: Bitcoin ‘To Overtake’ The Dollar By 2050 And Soar To $66,000 By The End Of 2021",Forbes,"A panel of cryptocurrency experts has predicted bitcoin will overtake the U.S. dollar as the dominant form of global finance by the year 2050—putting the bitcoin price at just over $66,000 by the end of 2021...","Bitcoin has struggled over the last few months, falling by more than half from its peak of around $65,000 set in April.
The bitcoin price is still up significantly from before it began its latest ra… [+3768 chars]",2021-07-17,https://www.forbes.com/sites/billybambrough/2021/07/17/crypto-price-prediction-bitcoin-to-overtake-the-dollar-by-2050-and-soar-to-66000-by-the-end-of-2021/,https://thumbor.forbes.com/thumbor/fit-in/1200x0/filters%3Aformat%28jpg%29/https%3A%2F%2Fspecials-images.forbesimg.com%2Fimageserve%2F60f2f915e9e5f953ecb4358e%2F0x0.jpg
Are Bitcoin Prices Heading For Intense Volatility?,Forbes,"Bitcoin prices have continued to suffer from lackluster volatility in recent weeks. The cryptocurrency may be gearing up for a strong move to the upside, according to certain market observers.","Bitcoin prices may be headed for a serious breakout, some analysts predict. 
Getty
Bitcoin prices have been suffering from a distinct malaise lately, trading within a reasonably defined range for s… [+3025 chars]",2021-07-15,https://www.forbes.com/sites/cbovaird/2021/07/15/are-bitcoin-prices-heading-for-intense-volatility/,https://thumbor.forbes.com/thumbor/fit-in/1200x0/filters%3Aformat%28jpg%29/https%3A%2F%2Fspecials-images.forbesimg.com%2Fimageserve%2F1065940934%2F0x0.jpg
