title,source,description,content,pub_date,url,photo_url
Gaming is coming to get us,Marginalrevolution.com,"That is the theme of my latest Bloomberg column, the first part concerns culture, but here is the section on government regulation: The self-contained nature of games also means they will be breaking down government regulation. Plenty of trading already takes…","That is the theme of my latest Bloomberg column, the first part concerns culture, but here is the section on government regulation:The self-contained nature of games also means they will be breaking … [+2256 chars]",2021-09-06,https://marginalrevolution.com/marginalrevolution/2021/09/gaming-is-coming-to-get-us.html,https://marginalrevolution.com/wp-content/uploads/2016/10/MR-logo-thumbnail.png
"Solana Overtakes Dogecoin As Ethereum Price Hits $4,000 For First Time Since $1 Trillion Crypto Crash",Forbes,"Growing buzz around blockchain-based smart contracts has fueled massive gains in cryptocurrencies like sol, ether and Cardano's ada.",Cryptocurrencies leading the market for blockchain-based smart contractsthe self-executing agreements underpinning the buzzy digital collectibles known as non-fungible tokensled a stunning Friday ral… [+3910 chars],2021-09-03,https://www.forbes.com/sites/jonathanponciano/2021/09/03/solana-overtakes-dogecoin-ethereum-price-hits-4000/,https://thumbor.forbes.com/thumbor/fit-in/1200x0/filters%3Aformat%28jpg%29/https%3A%2F%2Fspecials-images.forbesimg.com%2Fimageserve%2F613248cdc1459f807672de2d%2F0x0.jpg%3FcropX1%3D0%26cropX2%3D1418%26cropY1%3D73%26cropY2%3D871
Where Does Cryptocurrency Come From?,Yahoo Entertainment,It's fairly common knowledge that cryptocurrency is a decentralized digital medium of exchange that isn't issued by a government or bank. Most people are...,"Jirapong Manustrong / iStock.com
Its fairly common knowledge that cryptocurrency is a decentralized digital medium of exchange that isnt issued by a government or bank. Most people are probably fami… [+5478 chars]",2021-09-05,https://finance.yahoo.com/news/where-does-cryptocurrency-come-110013805.html,https://s.yimg.com/ny/api/res/1.2/cJsYppWZrNfa_FkSBetU8w--/YXBwaWQ9aGlnaGxhbmRlcjt3PTEyMDA7aD02NzU-/https://s.yimg.com/uu/api/res/1.2/HLxwZALkS9H3ggBUJHHkdQ--~B/aD0xMDgwO3c9MTkyMDthcHBpZD15dGFjaHlvbg--/https://media.zenfs.com/en/gobankingrates_644/01bbcf92d0cb977e81c2abaa74578924
Are You Ready for Bitcoin's Capital Flight into Other Cryptos?,Motley Fool,The technology behind Bitcoin is rapidly becoming obsolete.,"It's been less than 13 years since the creation of the world's first and largest digital currency, but Bitcoin (CRYPTO:BTC) is already on its way to becoming a thing of the past. Sometimes in investi… [+4585 chars]",2021-09-03,https://www.fool.com/investing/2021/09/03/are-you-ready-for-bitcoins-capital-flight-into-oth/,https://g.foolcdn.com/editorial/images/640003/gettyimages-1167779631.jpg
"‘Important’—Elon Musk Backs Major Dogecoin Upgrade As Bitcoin, Ethereum, Cardano And Solana Send The Crypto Market Price Towards $2.3 Trillion",Forbes,"Tesla chief executive Elon Musk has weighed in a major dogecoin upgrade, designed to secure the dogecoin blockchain reduce transaction fees, calling it ""important""...","Bitcoin and cryptocurrency prices have surged back in recent weeks after crashing earlier this year.
The bitcoin price, which touched $65,000 per bitcoin in April before dropping to under $30,000, h… [+3653 chars]",2021-09-03,https://www.forbes.com/sites/billybambrough/2021/09/03/important-elon-musk-backs-major-dogecoin-upgrade-as-bitcoin-ethereum-cardano-and-solana-send-the-crypto-market-price-towards-23-trillion/,https://thumbor.forbes.com/thumbor/fit-in/1200x0/filters%3Aformat%28jpg%29/https%3A%2F%2Fspecials-images.forbesimg.com%2Fimageserve%2F5fdfb56d111d68467d2218f3%2F0x0.jpg
The arguments for firing Jay Powell are tiresome and stupid,Business Insider,The Fed's main job is monetary policy. Jay Powell has made excellent monetary policy. So his opponents must search for bizarre reasons to replace him.,"The 
 Federal Reserve has a number of functions and responsibilities, but the most important thing the central bank does is set monetary policy. I feel weird even needing to write that sentence, but… [+12218 chars]",2021-09-03,https://www.businessinsider.com/arguments-firing-reappoint-federal-reserve-chairman-jerome-powell-tiresome-stupid-2021-9,https://i.insider.com/6132350a084ba30018161ebc?width=1200&format=jpeg
"The Most Interesting Price Charts Of The Week: Gold, Bitcoin, Ether, Analyzed",Forbes,Let’s start with the price of gold because hardly anyone cares anymore and that might be a sign of something.,"Price charts.
getty
Lets start with the price of gold because hardly anyone cares anymore and that might be a sign of something, emphasis on the might. When youve got a hot, new cryptocurrency ever… [+2908 chars]",2021-09-04,https://www.forbes.com/sites/johnnavin/2021/09/04/the-most-interesting-price-charts-of-the-week-gold-bitcoin-ether-analyzed/,https://thumbor.forbes.com/thumbor/fit-in/1200x0/filters%3Aformat%28jpg%29/https%3A%2F%2Fspecials-images.forbesimg.com%2Fimageserve%2F610eb70ace036fd4f2a5a586%2F0x0.jpg
Bitcoin price slips 1.4% Friday morning - Fox Business,Fox Business,Bitcoin price slips 1.4% Friday morning  Fox Business,"Bitcoin
 was trading 1.4% lower on Friday morning.
The price was around $49,400 per coin, while rivals Ethereum and Dogecoin
 were trading around $3,800 and 29 cents per coin, respectively, accord… [+1782 chars]",2021-09-03,https://www.foxbusiness.com/markets/bitcoin-price-9-3-2021,https://a57.foxnews.com/static.foxbusiness.com/foxbusiness.com/content/uploads/2018/03/0/0/Bitcoin.jpg?ve=1&tl=1
Amazon Is Working on Live Audio and Twitter Introducing Bitcoin Tipping in This Week’s Business and Crypto Roundup,HYPEBEAST,"Many brands are starting to see a recovery despite the challenges initially brought on by the pandemic. Some businesses, especially ones that focused efforts on expanding e-commerce ventures, have even seen profits rise even higher than before.HYPEBEAST has r…","Many brands are starting to see a recovery despite the challenges initially brought on by the pandemic. Some businesses, especially ones that focused efforts on expanding e-commerce ventures, have ev… [+3931 chars]",2021-09-04,https://hypebeast.com/2021/9/top-crypto-and-business-stories-of-the-week-september-3,https://image-cdn.hypb.st/https%3A%2F%2Fhypebeast.com%2Fimage%2F2021%2F09%2Ftop-crypto-and-business-stories-of-the-week-september-3-tw.jpg?w=960&cbr=1&q=90&fit=max
Survey: 56% of Australians Incorrectly Believe Elon Musk Invented Bitcoin,Bitcoin Magazine,A report about the state of Bitcoin and cryptocurrency in Australia for August suggests that 56% of Australians believe Elon Musk invented Bitcoin.,"A report about the state of Bitcoin and cryptocurrency in Australia for August released by Finder suggests that 56% of Australians believe Elon Musk invented Bitcoin. Finder, who carried out the stud… [+2799 chars]",2021-09-03,https://bitcoinmagazine.com/culture/survey-56-of-australians-incorrectly-believe-elon-musk-invented-bitcoin,https://bitcoinmagazine.com/.image/t_share/MTgzNjEwMjc4NzE2Mzg0MzAy/screen-shot-2021-09-03-at-121823.png
Vast Bank’s Bitcoin Move Shows Traditional Banks Are Becoming Serious With The Cryptocurrency Market,Yahoo Entertainment,Vast Bank has set the record as the first chartered bank in the United States to offer Bitcoin buying and custody services to its customers.,"Bitcoin is an investment vehicle that more people are looking to get into, and the traditional banks are not missing sight of this fact.
Vast Bank Starts Offering Bitcoin Buying And Custody Services… [+1994 chars]",2021-09-03,https://finance.yahoo.com/news/vast-bank-bitcoin-move-shows-101024039.html,https://s.yimg.com/uu/api/res/1.2/XBcqBuaA7bP45sTYEzupug--~B/aD00MTA7dz02MTU7YXBwaWQ9eXRhY2h5b24-/https://media.zenfs.com/en/fx_empire_176/0a3fb52d2dea1cc742a0dda4e6e7aaad
"Why Ethereum, Tezos, and FTX Are Soaring This Week",Motley Fool,Innovations behind these decentralized finance tokens are picking up speed.,"What happened 
Ethereum (CRYPTO:ETH), Tezos (CRYPTO:XTZ), and FTX (CRYPTO:FTT) are up 21.28%, 7.97%, and 29.12%, respectively, in the past seven days as of 10:42 a.m. EDT Saturday. They are now trad… [+3059 chars]",2021-09-04,https://www.fool.com/investing/2021/09/04/why-ethereum-tezos-and-ftx-are-soaring-this-week/,https://g.foolcdn.com/editorial/images/642044/gettyimages-1307283431.jpg
Beware miners selling thrashed second-hand SSDs as new,PC Gamer,Falling Chia coin pricing has seen miners selling off drives at a loss or rebadging them as new.,"Chia miners are getting out of the cryptocurrency storage market and either selling their old, thrashed drives at a loss or repackaging them and reselling them as new (according to VNExpress). That's… [+1648 chars]",2021-09-06,https://www.pcgamer.com/beware-miners-selling-thrashed-second-hand-ssds-as-new/,https://cdn.mos.cms.futurecdn.net/KNwkjYbwyebk24BzHsrH8C-1200-80.jpg
This Nixie tube tabletop clock adds a retro-punk flavor to your otherwise boring smart home appliances,Yanko Design,"This Nixie tube tabletop clock adds a retro-punk flavor to your otherwise boring smart home appliancesIf you’re the kind of person to simultaneously live in the 80s as well as the 2020s, the Nextube may be just the perfect little desktop...","If you’re the kind of person to simultaneously live in the 80s as well as the 2020s, the Nextube may be just the perfect little desktop accessory for you.
While I love what Apple, Google, and Amazon… [+4445 chars]",2021-09-06,https://www.yankodesign.com/2021/09/05/this-nixie-tube-tabletop-clock-adds-a-retro-punk-flavor-to-your-otherwise-boring-smart-home-appliances/,
Why China's bitcoin miners are moving to Texas,Yahoo Entertainment,Beijing's crackdown on cryptocurrency sends bitcoin entrepreneurs moving to the wild wild west.,"Mini figure of a bitcoin miner
China's ban on cryptocurrency mining has forced bitcoin entrepreneurs to flee overseas. Many are heading to Texas, which is quickly becoming the next global cryptocurr… [+6051 chars]",2021-09-03,https://news.yahoo.com/why-chinas-bitcoin-miners-moving-231305739.html,https://s.yimg.com/uu/api/res/1.2/0tXNQdnZlTkeksIavTo_.g--~B/aD01NDk7dz05NzY7YXBwaWQ9eXRhY2h5b24-/https://media.zenfs.com/en/bbc_us_articles_995/528438982e6c583dfff43e7437a53992
"We Are Living Through a Cryptocurrency Renaissance, Says KuCoin CEO",Yahoo Entertainment,"Johnny Lyu, CEO of KuCoin, speaks about the cryptocurrency renaissance currently underway and how these new developments are evolving crypto.","BeInCrypto 
Cryptocurrency exchanges are important nodes in the cryptocurrency ecosystem. The people who run them become influencers with the degree of their influence, often depending on the sizes … [+532 chars]",2021-09-05,https://finance.yahoo.com/news/living-cryptocurrency-renaissance-says-kucoin-150000643.html,https://s.yimg.com/uu/api/res/1.2/FWCS08fUOOGe2NY1GSEieA--~B/aD03MjA7dz0xMjAwO2FwcGlkPXl0YWNoeW9u/https://media.zenfs.com/en/beincrypto_articles_718/863aab0203ada8a1db8ebe35f3618d44
COCO Cocoin Cryptocurrency Top Community-Driven Limited Altcoin System Expanded,Yahoo Entertainment,Crypto Marketing Company announces the expansion of the Cocoin cryptocurrency system to introduce strategies developed from suggestions voted on by its...,Crypto Marketing Company announces the expansion of the Cocoin cryptocurrency system to introduce strategies developed from suggestions voted on by its investor community. These strategies will expan… [+3579 chars],2021-09-04,https://finance.yahoo.com/news/coco-cocoin-cryptocurrency-top-community-045600708.html,https://s.yimg.com/uu/api/res/1.2/Ok2CPbvfb7wTlGl_ZiJ4wA--~B/aD00ODA7dz00NzE7YXBwaWQ9eXRhY2h5b24-/https://media.zenfs.com/en/globenewswire.com/3ccc7de23c8a552290f47cdae59d5cff
Litecoin Prices Reach A 3-Month High As Fundamentals Continue To Improve,Forbes,Litecoin prices reached their highest since May 19 today. The digital currency's network has been benefiting from stronger activity lately. Where will litecoin prices go in the coming weeks and months?,"Litecoin prices have more than doubled since July. (Photo by Chesnot/Getty Images)
Getty Images
Litecoin prices have rallied lately, climbing to their highest since mid-May as the digital currencys… [+2472 chars]",2021-09-05,https://www.forbes.com/sites/cbovaird/2021/09/05/litecoin-prices-reach-a-3-month-high-as-fundamentals-continue-to-improve/,https://thumbor.forbes.com/thumbor/fit-in/1200x0/filters%3Aformat%28jpg%29/https%3A%2F%2Fspecials-images.forbesimg.com%2Fimageserve%2F613518b35f92d441536ec1de%2F0x0.jpg
"3 Hypergrowth Stocks Expected to Increase Sales 1,185% to 12,629% by 2023",Motley Fool,These fast-paced companies should generate jaw-dropping revenue growth over the next three years.,"Since the end of the Great Recession in 2009, growth stocks have thrived. Historically low lending rates, an ongoing quantitative easing program designed to weigh down long-term bond yields, and a fr… [+7967 chars]",2021-09-03,https://www.fool.com/investing/2021/09/03/3-hypergrowth-stocks-increase-sales-1185-to-12629/,https://g.foolcdn.com/editorial/images/641361/financial-newspaper-graph-showing-gains-getty.jpg
"3 Far More Exciting Cryptocurrencies Than Dogecoin, According to a Crypto Skeptic",Motley Fool,"These digital currencies offer differentiation that's not seen with the ""people's currency.""","For more than a century, the stock market has been the undisputed leading wealth creator. While it may not surpass the returns of gold, housing, or bonds every year, it's delivered the highest averag… [+7566 chars]",2021-09-05,https://www.fool.com/investing/2021/09/05/3-far-more-exciting-cryptocurrencies-than-dogecoin/,https://g.foolcdn.com/editorial/images/641690/rising-stock-chart-investing-crypto-laptop-trade-getty.jpg
"Got $1,000? Here Are 3 Growth Stocks to Buy Now",Motley Fool,"Growth stocks generate revenue and earnings that exceed the industry average, which is why they can be a great place to park your money.","Growth stocks are always an exciting place to invest because they represent companies with strong cash flows, and revenue and earnings that are expected to outpace the industry average. Additionally,… [+6728 chars]",2021-09-05,https://www.fool.com/investing/2021/09/05/got-1000-here-are-3-growth-stocks-to-buy-now/,https://g.foolcdn.com/editorial/images/641718/watering-money-getty.jpg
"ACE Exchange Tackles Cryptocurrency Money Laundering With KPMG, KGI Bank and CYBAVO",Yahoo Entertainment,"As nations around the world step up trying to take control over cryptocurrencies to prevent financial crimes, ACE Exchange, a leading cryptocurrency exchange...","TAIPEI, Sept. 2, 2021 /PRNewswire/ -- As nations around the world step up trying to take control over cryptocurrencies to prevent financial crimes, ACE Exchange, a leading cryptocurrency exchange bas… [+3721 chars]",2021-09-03,https://finance.yahoo.com/news/ace-exchange-tackles-cryptocurrency-money-014700888.html,https://s.yimg.com/uu/api/res/1.2/FD12u3alr5QUqYQ8N5iIYQ--~B/aD00MDA7dz00MDA7YXBwaWQ9eXRhY2h5b24-/https://media.zenfs.com/en/prnewswire.com/b621007ff0c511d2f8148bce57702546
"Biconomy Exchange Token – BIT $50,000 Airdrop and listing on PancakeSwap",Yahoo Entertainment,"Toronto, Canada, Sept. 06, 2021 (GLOBE NEWSWIRE) -- (via Blockchain Wire) The cryptocurrency market is constantly evolving and new crypto assets are...","Toronto, Canada, Sept. 06, 2021 (GLOBE NEWSWIRE) -- (via Blockchain Wire) The cryptocurrency market is constantly evolving and new crypto assets are continually entering the market. However, very own… [+4332 chars]",2021-09-06,https://finance.yahoo.com/news/biconomy-exchange-token-bit-50-130000071.html,https://s.yimg.com/uu/api/res/1.2/IjU9knUimZLkYsnRflN.UA--~B/aD05NDt3PTI2MjthcHBpZD15dGFjaHlvbg--/https://media.zenfs.com/en/globenewswire.com/8a791017ab2c490a4454095f9c5b7006
How ChainXworld Is Using DeFi and Blockchain Technology to Transform the Real Estate and E-Commerce Industries,Yahoo Entertainment,"Geneva, Switzerland, Sept. 03, 2021 (GLOBE NEWSWIRE) -- In 2021, the cryptocurrency space has seen remarkable growth. All-time highs and ever-expanding use...","Geneva, Switzerland, Sept. 03, 2021 (GLOBE NEWSWIRE) -- In 2021, the cryptocurrency space has seen remarkable growth. All-time highs and ever-expanding use-cases have led to entire industries being t… [+2719 chars]",2021-09-03,https://finance.yahoo.com/news/chainxworld-using-defi-blockchain-technology-111900245.html,https://s.yimg.com/uu/api/res/1.2/bKkmaBpvgaBVWewNhKIxTg--~B/aD0zMTI7dz04MjA7YXBwaWQ9eXRhY2h5b24-/https://media.zenfs.com/en/globenewswire.com/18e67e181b5c7f050e6406e0be11e692
The First Cryptocurrency Exchange Traded Fund (ETF) in DeFi Set to Debut around Mid-September by DogeHouse Capital,Yahoo Entertainment,"Cryptocurrency ETFs are already making their way into the world of DeFi.NEW YORK, NY / ACCESSWIRE / September 3, 2021 / Recently, DogeHouse Capital, the...","Cryptocurrency ETFs are already making their way into the world of DeFi.
NEW YORK, NY / ACCESSWIRE / September 3, 2021 / Recently, DogeHouse Capital, the multinational cryptocurrency company, has pr… [+3384 chars]",2021-09-03,https://finance.yahoo.com/news/first-cryptocurrency-exchange-traded-fund-132500102.html,https://s.yimg.com/uu/api/res/1.2/vaK_BNV53aGe0LGTY9mmng--~B/aD05NzY7dz05MDA7YXBwaWQ9eXRhY2h5b24-/https://media.zenfs.com/en/accesswire.ca/682aeed9d34a56656e5e09487b634a39
Binance Cuts Singapore Dollar Pairs After Troubles With MAS,Yahoo Entertainment,"The Binance cryptocurrency exchange said that it will soon be ceasing SGD trading pairs, SGD payment options, and is removing its application from the...","BeInCrypto 
In a recent announcement, the Binance cryptocurrency exchange said that it will soon be ceasing SGD trading pairs, SGD payment options, and is removing its application from the Singapore… [+1274 chars]",2021-09-05,https://finance.yahoo.com/news/binance-cuts-singapore-dollar-pairs-161434345.html,https://s.yimg.com/uu/api/res/1.2/SHDuWbPDoZv800oO0OyhgA--~B/aD03MjA7dz0xMjAwO2FwcGlkPXl0YWNoeW9u/https://media.zenfs.com/en/beincrypto_articles_718/96d3c174fa7f544fec5d78234043673f
Binance removes Singapore products on main platform after regulator's warning,Yahoo Entertainment,"Embattled Binance, one of the world's largest cryptocurrency exchanges, said it will restrict its services in Singapore days after the city state's central...","By Alun John
HONG KONG (Reuters) - Embattled Binance, one of the world's largest cryptocurrency exchanges, said it will restrict its services in Singapore days after the city state's central bank sa… [+1482 chars]",2021-09-06,https://finance.yahoo.com/news/binance-removes-singapore-products-main-025030356.html,https://s.yimg.com/uu/api/res/1.2/r6qOE.tnBIcS1OEOK_SHmw--~B/aD01MjY7dz04MDA7YXBwaWQ9eXRhY2h5b24-/https://media.zenfs.com/en/reuters-finance.com/95eaa0573fac228713fae7cea09a5472
Ethereum Rival Solana Climbs to Seventh in Crypto Top 10,Yahoo Entertainment,(Bloomberg) -- The cryptocurrency linked to the Solana network has jumped to the seventh spot among the world’s top 10 largest virtual coins amid optimism...,(Bloomberg) -- The cryptocurrency linked to the Solana network has jumped to the seventh spot among the worlds top 10 largest virtual coins amid optimism that the blockchain could be a long term comp… [+2491 chars],2021-09-06,https://finance.yahoo.com/news/token-ethereum-rival-solana-jumps-062253042.html,https://s.yimg.com/ny/api/res/1.2/T5up3lva0o_9NOPbun3Lrw--/YXBwaWQ9aGlnaGxhbmRlcjt3PTEyMDA7aD04MDA-/https://s.yimg.com/uu/api/res/1.2/T.i9ai0Es_L8jUg9fePPAw--~B/aD0xMzM0O3c9MjAwMDthcHBpZD15dGFjaHlvbg--/https://media.zenfs.com/en/bloomberg_markets_842/b4306904ad68214145a3c8ece4f8139b
Alchemy Pay's ACH Lists on Coinone in South Korea,Yahoo Entertainment,"The world's 14th largest cryptocurrency exchange by spot trading volume, Coinone, now supports trading and custody of Alchemy Pay's utility token, ACH, for...","Payment gateway utility token gains further traction in Asian markets
SINGAPORE, Sept. 3, 2021 /PRNewswire/ -- The world's 14th largest cryptocurrency exchange by spot trading volume, Coinone, now s… [+4284 chars]",2021-09-03,https://finance.yahoo.com/news/alchemy-pays-ach-lists-coinone-094200356.html,https://s.yimg.com/uu/api/res/1.2/aDNDmA6amm8Tu7NSmVfDFQ--~B/aD04Njt3PTQwMDthcHBpZD15dGFjaHlvbg--/https://media.zenfs.com/en/prnewswire.com/0f52da9bc2b55f8a1f1fe0611ce948d6
"ACE Exchange Tackles Cryptocurrency Money Laundering With KPMG, KGI Bank and CYBAVO",Yahoo Entertainment,"As nations around the world step up trying to take control over cryptocurrencies to prevent financial crimes, ACE Exchange, a leading cryptocurrency exchange...","TAIPEI, Sept. 3, 2021 /PRNewswire/ -- As nations around the world step up trying to take control over cryptocurrencies to prevent financial crimes, ACE Exchange, a leading cryptocurrency exchange bas… [+3562 chars]",2021-09-03,https://finance.yahoo.com/news/ace-exchange-tackles-cryptocurrency-money-030500731.html,https://s.yimg.com/uu/api/res/1.2/SK9TCYWB1EH0yRosbS7nrQ--~B/aD00MDA7dz00MDA7YXBwaWQ9eXRhY2h5b24-/https://media.zenfs.com/en/prnewswire.com/1e42bb9a901fb6bea02cee71d82d761e
People Are Spending Thousands of Dollars Turning NFTs Into a Game,HYPEBEAST,"NFT collectors are now spending thousands of dollars worth of Ethereum cryptocurrency on virtual game items that don't actually belong to any game, feature any artwork, or have any stats to them.The project — known as Loot — was launched by American entrepren…","NFT collectors are now spending thousands of dollars worth of Ethereumcryptocurrency on virtual game items that don’t actually belong to any game, feature any artwork, or have any stats to them.
The… [+1726 chars]",2021-09-05,https://hypebeast.com/2021/9/non-fungible-tokens-loot-game-unique-items,https://image-cdn.hypb.st/https%3A%2F%2Fhypebeast.com%2Fimage%2F2021%2F09%2Fnon-fungible-tokens-loot-game-unique-items-tw.jpg?w=960&cbr=1&q=90&fit=max
Is the Venmo Credit Card Worthwhile?,Yahoo Entertainment,"If you rely on Venmo, an app that lets you send money to someone or pay a merchant that accepts this cashless option, you may have considered applying for a ...","If you rely on Venmo, an app that lets you send money to someone or pay a merchant that accepts this cashless option, you may have considered applying for a Venmo Credit Card. The card became widely … [+6652 chars]",2021-09-03,https://news.yahoo.com/venmo-credit-card-worthwhile-141319833.html,https://s.yimg.com/cv/apiv2/social/images/yahoo_default_logo-1200x1200.png
Why China's bitcoin miners are moving to Texas,BBC News,Beijing's crackdown on cryptocurrency sends bitcoin entrepreneurs moving to the wild wild west.,"By Zhaoyin FengBBC News, Washington
China's ban on cryptocurrency mining has forced bitcoin entrepreneurs to flee overseas. Many are heading to Texas, which is quickly becoming the next global crypt… [+6268 chars]",2021-09-03,https://www.bbc.co.uk/news/world-us-canada-58414555,https://ichef.bbci.co.uk/news/1024/branded_news/380B/production/_99474341_hi043743901.jpg
"Bitcoin Braced For A 3.3 Million-Strong Global Earthquake This Week As The Price Of Ethereum, Cardano, BNB, XRP, Solana And Dogecoin Soar",Forbes,"With El Salvador gearing up to adopt bitcoin as legal tender along side the U.S. dollar this week, social media users coordinating bitcoin purchases to coincide with the $30 worth of bitcoin that's being distributed to all Salvadorans...","Bitcoin and cryptocurrencies have surged over the last couple of months, with the bitcoin price hitting highs of around $52,000 per bitcoinup from under $30,000 just a few months ago. 
The price of … [+4918 chars]",2021-09-06,https://www.forbes.com/sites/billybambrough/2021/09/06/bitcoin-is-braced-for-a-huge-global-earthquake-this-week-as-the-price-of-ethereum-cardano-bnb-xrp-solana-and-dogecoin-continue-to-soar/,https://thumbor.forbes.com/thumbor/fit-in/1200x0/filters%3Aformat%28jpg%29/https%3A%2F%2Fspecials-images.forbesimg.com%2Fimageserve%2F600e90d9ead65a55f4e7644f%2F0x0.jpg
Why Nvidia Stock Jumped 15% in August,Motley Fool,"In 2021, shares of the gaming and tech giant have returned 75%.","What happened
Nvidia(NASDAQ:NVDA) stock popped 14.8% in August, significantly outpacing the S&amp;P 500's 3% return, according to data from S&amp;P Global Market Intelligence. 
This robust performa… [+1856 chars]",2021-09-04,https://www.fool.com/investing/2021/09/04/why-nvidia-stock-jumped-15-in-august/,https://g.foolcdn.com/editorial/images/642036/nvda-stock-nvidia-stock-nvda-earnings-is-nvda-a-buy-best-tech-stocks-best-growth-stocks-to-buy-2021.jpg
Crypto Trading App,Visual.ly,TradeSoft has the best web trading platform that also supports Crypto Trading Platforms. This means you can run a crypto trading app using any cryptoc,6 TradeSoft TradeSoft has the best web trading platform that also supports Crypto Trading Platforms. This means you can run a crypto trading app using any cryptocurrency. BTRADESOFT Skrill JETAPAY 00… [+154 chars],2021-09-06,https://visual.ly/community/Infographics/business/crypto-trading-app,http://thumbnails-visually.netdna-ssl.com/crypto-trading-app_6135c42eb7576_w250_h250.jpg
