title,source,description,content,pub_date,url,photo_url
Binance removes Singapore products on main platform after regulator's warning - Reuters,Reuters,"Binance, one of the world's largest cryptocurrency exchanges, said it will restrict its services in Singapore days after the city state's central bank said it should stop offering payment services.","Binance logo and stock graph are displayed in this illustration taken, June 28, 2021. REUTERS/Dado Ruvic/Illustration/File PhotoHONG KONG, Sept 6 (Reuters) - Binance, one of the world's largest crypt… [+467 chars]",2021-09-06,https://www.reuters.com/world/asia-pacific/binance-removes-singapore-products-main-platform-after-regulators-warning-2021-09-06/,https://www.reuters.com/resizer/slBZMWsQzno4cDJkBThemgJkm7w=/1200x628/smart/filters:quality(80)/cloudfront-us-east-2.images.arcpublishing.com/reuters/OOPX2CCQJNKNZNWXU445KRUUEY.jpg
"Ether above $4,000 for first time since May 15 - Reuters.com",Reuters,"Ether, the second-biggest cryptocurrency, on Friday passed $4,000 for the first time since May 15, with analysts citing frenzied demand for non-fungible tokens (NFTs) as a driver of recent momentum.","By Reuters Staff
NEW YORK, Sept 3 (Reuters) - Ether, the second-biggest cryptocurrency, on Friday passed $4,000 for the first time since May 15, with analysts citing frenzied demand for non-fungible… [+577 chars]",2021-09-03,https://www.reuters.com/article/crypto-currency-ethereum-idUSL1N2Q51B2,https://s1.reutersmedia.net/resources_v2/images/rcom-default.png?w=800
U.S. SEC investigates crypto exchange developer Uniswap Labs - WSJ - Reuters,Reuters,"The U.S. Securities and Exchange Commission (SEC) is investigating Uniswap Labs, the main developer behind one of the world's largest cryptocurrency exchanges, the Wall Street Journal reported on Friday https://www.wsj.com/articles/regulators-investigate-cryp…","By Reuters Staff
Sept 3 (Reuters) - The U.S. Securities and Exchange Commission (SEC) is investigating Uniswap Labs, the main developer behind one of the world's largest cryptocurrency exchanges, th… [+735 chars]",2021-09-03,https://www.reuters.com/article/crypto-currency-uniswap-idUSL4N2Q52NJ,https://s1.reutersmedia.net/resources_v2/images/rcom-default.png?w=800
UPDATE 1-U.S. SEC investigates crypto exchange developer Uniswap Labs - WSJ - Reuters,Reuters,"The U.S. Securities and Exchange Commission (SEC) is investigating Uniswap Labs, the main developer behind one of the world's largest cryptocurrency exchanges, Uniswap, the Wall Street Journal reported on Friday https://www.wsj.com/articles/regulators-investi…","By Reuters Staff
Representations of cryptocurrencies Bitcoin, Ethereum, DogeCoin, Ripple, Litecoin are placed on PC motherboard in this illustration taken June 29, 2021. REUTERS/Dado Ruvic/Illustrat… [+1168 chars]",2021-09-03,https://www.reuters.com/article/crypto-currency-uniswap-idUSKBN2FZ18E,https://static.reuters.com/resources/r/?m=02&d=20210903&t=2&i=1573786764&r=LYNXMPEH820LX&w=800
Binance removes Singapore products on main platform after regulator's warning - Reuters,Reuters,"Binance, one of the world's largest cryptocurrency exchanges, said it will restrict its services in Singapore days after the city state's central bank said it should stop offering payment services.","By Reuters Staff
HONG KONG, Sept 6 (Reuters) - Binance, one of the worlds largest cryptocurrency exchanges, said it will restrict its services in Singapore days after the city states central bank sa… [+252 chars]",2021-09-06,https://www.reuters.com/article/fintech-crypto-binance-idUSL1N2Q8032,https://s1.reutersmedia.net/resources_v2/images/rcom-default.png?w=800
"What is the Wifedoge? Meet the cryptocurrency 'wife' of Dogecoin that grew more than 3,000% in one day and Elon Musk already 'liked' it",Entrepreneur,"In just 24 hours, the new cryptocurrency Wifecoin, 'wife' and clone of Dogecoin, increased its market capitalization by more than 3,000%, should you buy?","September
3, 2021
4 min read
This article was translated from our Spanish edition using AI technologies. Errors may exist due to this process.
Opinions expressed by Entrepreneur contributors are … [+3422 chars]",2021-09-03,https://www.entrepreneur.com/article/383729,https://assets.entrepreneur.com/content/3x2/2000/1630707370-Sep3WifedogDogecoinElonMuskcritomonedas.jpg
Bitcoin rises back above $50000 - Reuters,Reuters,"Bitcoin  rose 0.49% to $50,188.4 at 1004 GMT on Sunday, adding $245.24 to its previous close.","A representation of cryptocurrency Bitcoin is seen in this illustration taken August 6, 2021. REUTERS/Dado Ruvic/IllustrationSept 5 (Reuters) - Bitcoin rose 0.49% to $50,188.4 at 1004 GMT on Sunday, … [+396 chars]",2021-09-05,https://www.reuters.com/technology/bitcoin-rises-back-above-50000-2021-09-05/,https://www.reuters.com/resizer/JeIIdKfQjN97IzsPbj4MeKYy2hQ=/1200x628/smart/filters:quality(80)/cloudfront-us-east-2.images.arcpublishing.com/reuters/C44YCSGHYJNU3FOAERYSMGIBWI.jpg
"Cardano, the cryptocurrency that could become the most valuable in the cyber world",Altonivel.com.mx,"In contention with global leaders, virtual currency challenges bitcoin and ether.","September
6, 2021
3 min read
This article was translated from our Spanish edition using AI technologies. Errors may exist due to this process.
This story originally appeared on Alto Nivel
p&gt; … [+2511 chars]",2021-09-06,https://www.altonivel.com.mx/actualidad/cardano-la-criptomoneda-que-reta-al-bitcoin-y-al-ether-podria-volverse-la-mas-valiosa-del-cibermundo/?amp=1,https://assets.entrepreneur.com/content/3x2/2000/1630705603-cardano.jpg
"Bitcoin rises back above $50,000 - Reuters",Reuters,"Bitcoin rose 0.49% to $50,188.4 at 1004 GMT on Sunday, adding $245.24 to its previous close.","By Reuters Staff
Sept 5 (Reuters) - Bitcoin rose 0.49% to $50,188.4 at 1004 GMT on Sunday, adding $245.24 to its previous close.
The worlds biggest and best-known cryptocurrency is up 81% from this… [+233 chars]",2021-09-05,https://www.reuters.com/article/crypto-currency-bitcoin-idUSL4N2Q704D,https://s1.reutersmedia.net/resources_v2/images/rcom-default.png?w=800
Cardano joins crypto's creative destruction loop - Reuters,Reuters,"Watch out, bitcoin and ether. Cryptocurrency platform Cardano had its ADA token pass the $3 mark for the first on Sept. 1, just weeks after becoming the world’s third-biggest virtual tender. While its total value at that price of $96 billion is roughly a fift…","Representations of cryptocurrencies Bitcoin, Ethereum, DogeCoin, Ripple, Litecoin are placed on PC motherboard in this illustration taken, June 29, 2021. REUTERS/Dado Ruvic/Illustration NEW YORK, Sep… [+2712 chars]",2021-09-03,https://www.reuters.com/breakingviews/cardano-joins-cryptos-creative-destruction-loop-2021-09-02/,https://www.reuters.com/resizer/ueJtkjyeNWawC2EeRlrxZljHXpM=/1200x628/smart/filters:quality(80)/cloudfront-us-east-2.images.arcpublishing.com/reuters/6UVNR3WPMRJC3G7S6WGOMPMYNE.jpg
Skepticism Grows Over El Salvador's Pioneering Plan to Adopt Bitcoin as Legal Tender,Slashdot.org,"This week the Guardian reported that a ""tumultuous few weeks"" awaits El Salvador as it prepares to become the first country to adopt Bitcoin as legal tender on Tuesday.

In August a research note by Bank of America enthused about the new law's ability to redu…","In August a research note by Bank of America enthused about the new law's ability to reduce the cost of cross-border transactions (remittances account for 20% of El Salvador's GDP), increase digital … [+1900 chars]",2021-09-05,https://yro.slashdot.org/story/21/09/05/049236/skepticism-grows-over-el-salvadors-pioneering-plan-to-adopt-bitcoin-as-legal-tender,https://a.fsdn.com/sd/topics/bitcoin_64.png
Kraken versus Binance: How the crypto exchanges compare,Business Insider,"Both Kraken and Binance offer low fees, but Kraken is more suitable for newer traders. Binance is a stronger choice for advanced users.","Personal Finance Insider writes about products, strategies, and tips to help you make smart decisions with your money. We may receive a small commission from our partners, like American Express, but … [+6555 chars]",2021-09-03,https://www.businessinsider.com/personal-finance/kraken-vs-binance,https://i.insider.com/61322ef49ef1e50018f9ab20?width=1200&format=jpeg
UK regulator says celebrities such as Kim Kardashian are putting investors at risk by pushing unknown crypto tokens,Business Insider,"Unsuspecting consumers are regularly being lured into crypto scams by social media influencers, the chair of the UK's FCA said.","Kim Kardashian promoted an unknown crypto token to her followers in June.
NurPhoto/Getty Images
The UK's financial watchdog has said celebrities such as Kim Kardashian are putting retail investors … [+2001 chars]",2021-09-06,https://markets.businessinsider.com/news/currencies/kim-kardashian-crypto-ethereum-max-cryptocurrency-regulator-fca-scam-risks-2021-9,https://images2.markets.businessinsider.com/61360382a1e5e7001996ea4f?format=jpeg
Will Gaming Change Humanity As We Know It?,Slashdot.org,"""The advent of gaming, especially computer gaming, marks a fundamental break in human affairs,"" argues American economist Tyler Cowen (in a Bloomberg opinion column). 

""Gaming is profoundly transforming two central aspects of the modern world: culture and re…","""The advent of gaming, especially computer gaming, marks a fundamental break in human affairs,"" argues American economist Tyler Cowen (in a Bloomberg opinion column).""Gaming is profoundly transformin… [+1886 chars]",2021-09-06,https://games.slashdot.org/story/21/09/06/0053246/will-gaming-change-humanity-as-we-know-it,https://a.fsdn.com/sd/topics/government_64.png
Banksy Was Warned About Website Flaw Before NFT Hack Scam,Slashdot.org,"Artist Banksy's team was warned his website had a security weakness seven days before a hacker scammed a fan out of $336,000. The BBC reports: On Tuesday a piece of art was advertised on Banksy's official website as the world-renowned graffiti artist's first …","On Tuesday a piece of art was advertised on Banksy's official website as the world-renowned graffiti artist's first NFT (non-fungible token). A British collector won the auction to buy it, before rea… [+1509 chars]",2021-09-03,https://it.slashdot.org/story/21/09/03/2018240/banksy-was-warned-about-website-flaw-before-nft-hack-scam,https://a.fsdn.com/sd/topics/security_64.png
Nobel Prize-winning economist Joseph Stiglitz explains why today's bull market isn't sustainable - and why he welcomes the US labor shortage,Business Insider,"""It distorts risk-taking. It creates bubbles,"" Stiglitz said about major US indices hitting record highs on a daily basis.","Joseph Stiglitz.
Stefano Guidi/Getty Images for Polito di Torino
US economist Joseph Stiglitz told CNBC on Thursday the current bull run in the market isn't sustainable, and he welcomes the tightne… [+2188 chars]",2021-09-03,https://markets.businessinsider.com/news/stocks/stock-market-outlook-joseph-stiglitz-tight-labor-market-fed-policy-2021-9,https://images2.markets.businessinsider.com/6131f30dee41b90019722671?format=jpeg
What is an NFT? Everything to know about the expensive digital tokens taking over cryptocurrency - CNET,CNET,"NFTs are tied to all types of art, but that doesn't mean you own it. We'll explain.","NFT art could be a new way to spend and make money.
Getty Images
Nonfungible tokens, or NFTs, are a new kind of collectible that could -- or could not -- earn you big bucks. NFTs began in 2017 and … [+7108 chars]",2021-09-04,https://www.cnet.com/personal-finance/what-is-an-nft-everything-to-know-about-the-expensive-digital-tokens-taking-over-cryptocurrency/,https://www.cnet.com/a/img/FipiXkLmteC2WrEvx8MqCMtD_g8=/1200x630/2021/04/06/ffd7569a-cf4f-4dbc-9612-ba6f51ba8f88/gettyimages-1231935363.jpg
Catching up with Twitter’s most recent head of corp dev — and new VC — Seksom Suriyapa,TechCrunch,"Seksom Suriyapa was seemingly destined to land at a venture firm. A Stanford Law graduate, he worked at two blue-chip investment banks before joining the cybersecurity company McAfee as a senior corp dev employee, later logging six years at the human resource…","Seksom Suriyapa was seemingly destined to land at a venture firm. A Stanford Law graduate, he worked at two blue-chip investment banks before joining the cybersecurity company McAfee as a senior corp… [+9343 chars]",2021-09-04,http://techcrunch.com/2021/09/03/catching-up-with-twitters-most-recent-head-of-corp-dev-and-new-vc-seksom-suriyapa/,https://techcrunch.com/wp-content/uploads/2021/09/Screen-Shot-2021-09-03-at-6.35.51-PM.png?w=478
"Market Pulse: Solana hits all time-high, Ether rises above $4,000 on path back to record for the crypto",MarketWatch,The price rallies of ether and solan were partly driven by the explosive growth of decentralized finance protocols and nonfungible tokens.,"Ether was trading above $4,000 on Friday, on a path to potentially return to its all-time high of $4,647 in May, while bitcoin has risen above $51,000. Solana, the seventh largest cryptocurrency by m… [+1185 chars]",2021-09-03,https://www.marketwatch.com/story/solana-hits-all-time-high-ether-rises-above-4-000-on-path-back-to-record-for-the-crypto-11630684288,https://images.mktw.net/im-333228/social
"US futures climb after stocks hit record highs, while the dollar flatlines ahead of key employment data",Business Insider,Nonfarm payrolls data for August will be very closely watched as it could influence when the Federal Reserve will start cutting its bond purchases.,"Economists expect nonfarm payrolls growth to have slowed in August.
Amira Karaoud/Reuters
US stock futures climbed on Friday while the dollar consolidated after a marked decline as investors awaite… [+2916 chars]",2021-09-03,https://markets.businessinsider.com/news/stocks/stock-market-today-jobs-nonfarm-payrolls-employment-federal-reserve-dollar-2021-9,https://images2.markets.businessinsider.com/6131d745ee41b90019722545?format=jpeg
How the world’s biggest dark web platform spreads child sex abuse material — and why it’s hard to stop,The Next Web,"Child sexual abuse material is rampant online, despite considerable efforts by big tech companies and governments to curb it. And according to reports, it has only become more prevalent during the COVID-19 pandemic. This material is largely hosted on the anon…","Child sexual abuse material is rampant online, despite considerable efforts by big tech companies and governments to curb it. And according to reports, it has only become more prevalent during the CO… [+7390 chars]",2021-09-03,https://thenextweb.com/news/how-worlds-biggest-dark-web-platform-spreads-child-sex-abuse-material-why-hard-stop-syndication,https://img-cdn.tnwcdn.com/image/tnw?filter_last=1&fit=1280%2C640&url=https%3A%2F%2Fcdn0.tnwcdn.com%2Fwp-content%2Fblogs.dir%2F1%2Ffiles%2F2021%2F09%2FTor-Browser-dark-web-Onion-hed.jpg&signature=5ff466d4bdf5d136a052b3cfb2945901
Here's Why Solana's Cryptocurrency Is Skyrocketing Today,Motley Fool,"The price per token for Solana's SOL is now up roughly 8,270% year to date.","What happened
The Solana (CRYPTO:SOL) cryptocurrency is soaring again on Friday. The token, called SOL, has climbed roughly 12.6% over the last 24 hours, and it set a record high for its price in to… [+1880 chars]",2021-09-03,https://www.fool.com/investing/2021/09/03/heres-why-solanas-cryptocurrency-is-skyrocketing-t/,https://g.foolcdn.com/editorial/images/641974/the-sun-and-a-rocket-blasting-above-the-clouds.jpg
"Crypto Banking and Decentralized Finance, Explained",New York Times,"The revolution in digital money is now moving into banking, as cryptocurrency starts to reshape the way people borrow and save.",DeFi platforms are structured to become independent from their developers and backers over time and to ultimately be governed by a community of users whose power comes from holding the protocols toke… [+2475 chars],2021-09-05,https://www.nytimes.com/2021/09/05/us/politics/cryptocurrency-explainer.html,https://static01.nyt.com/images/2021/08/27/us/politics/00dc-cryptoexplainer-sub/00dc-cryptoexplainer-sub-facebookJumbo.jpg
Why China's bitcoin miners are moving to Texas...,BBC News,Beijing's crackdown on cryptocurrency sends bitcoin entrepreneurs moving to the wild wild west.,"By Zhaoyin FengBBC News, Washington
China's ban on cryptocurrency mining has forced bitcoin entrepreneurs to flee overseas. Many are heading to Texas, which is quickly becoming the next global crypt… [+6268 chars]",2021-09-05,https://www.bbc.com/news/world-us-canada-58414555,https://ichef.bbci.co.uk/news/1024/branded_news/380B/production/_99474341_hi043743901.jpg
How Ethereum's Next Big Upgrade Could Boost Its Value,Motley Fool,The world's second-largest cryptocurrency has way more use cases than Bitcoin and may be a better long-term investment.,"Ethereum(CRYPTO:ETH)- the world's second-largest cryptocurrency, and the most popular smart contract and decentralized application network -- just changed the way it pays the people who maintain its … [+5465 chars]",2021-09-04,https://www.fool.com/investing/2021/09/04/how-ethereums-next-big-upgrade-could-boost-its-val/,https://g.foolcdn.com/editorial/images/641991/woman-using-ethereum.jpg
Why Nvidia Shares Beat the Market Today,Motley Fool,An analyst's price target upgrade and a healthy cryptocurrency market make for a strong end to the stock's week.,"What happened
Shares of Nvidia(NASDAQ:NVDA) closed Friday more than 2% higher, in contrast to a generally flat stock market. That followed a price target upgrade from one analyst tracking the stock.… [+1349 chars]",2021-09-03,https://www.fool.com/investing/2021/09/03/why-nvidia-is-beating-the-market-today/,https://g.foolcdn.com/editorial/images/641999/circuit-board.jpg
Learn a new skill for just $15 in this Labor Day sale,Boing Boing,"Need a new hobby? There's never been a better time to sit on your tush and learn a new skill than right now, especially now that we're going back into hibernation mode thanks to people making wrong choices. And, with this awesome deal, you can be up to snuff …","Need a new hobby? There's never been a better time to sit on your tush and learn a new skill than right now, especially now that we're going back into hibernation mode thanks to people making wrong c… [+3679 chars]",2021-09-05,https://boingboing.net/2021/09/05/learn-a-new-skill-for-just-15-in-this-labor-day-sale.html,https://i0.wp.com/boingboing.net/wp-content/uploads/2021/09/sale_299408_article_image.jpeg?fit=1200%2C800&ssl=1
"IoT Attacks Skyrocket, Doubling in 6 Months",Threatpost,"The first half of 2021 saw 1.5 billion attacks on smart devices, with attackers looking to steal data, mine cryptocurrency or build botnets.","The first half of 2021 saw 1.5 billion attacks on smart devices, with attackers looking to steal data, mine cryptocurrency or build botnets.The first six months of 2021 have seen a more than 100-perc… [+5134 chars]",2021-09-06,https://threatpost.com/iot-attacks-doubling/169224/,https://media.threatpost.com/wp-content/uploads/sites/103/2020/12/07105650/IoT-Security-Flaw.jpg
Top cryptocurrency exchange – Trustex.,Visual.ly,The context of exchange services is changing in an effort to incentivize more efficient market participation. The new paradigm of trading digital asse,"https://trustex.ai/ Trustex https://trustex.ai/ Trustex is one such top cryptocurrency exchange that utilizes the latest technology to serve as an easy way for individuals to trade, buy and sell cryp… [+97 chars]",2021-09-04,https://visual.ly/community/Infographics/business/top-cryptocurrency-exchange-%E2%80%93-trustex,http://thumbnails-visually.netdna-ssl.com/top-cryptocurrency-exchange--trustex_613389061bdbc_w250_h250.jpg
Crypto Rapid Move Into Banking Elicits Alarm in Washington...,Dnyuz.com,"Crypto Rapid Move Into Banking Elicits Alarm in Washington...

 
 
 
 (Third column, 17th story, link)

 

 

 
 Related stories:Bitcoin Price Pump Movement Grows Ahead of El Salvador Adoption...
China miners moving to Texas...","BlockFi, a fast-growing financial start-up whose headquarters in Jersey City are across the Hudson River from Wall Street, aspires to be the JPMorgan Chase of cryptocurrency.
It offers credit cards,… [+12504 chars]",2021-09-06,https://dnyuz.com/2021/09/05/cryptos-rapid-move-into-banking-elicits-alarm-in-washington/,https://dnyuz.com/wp-content/uploads/2021/09/Cryptos-Rapid-Move-Into-Banking-Elicits-Alarm-in-Washington.jpg
How crypto is making financial elite STRONGER...,Unherd.com,"How crypto is making financial elite STRONGER...

 
 
 
 (Third column, 1st story, link)

 

 

 
 Related stories:Bitcoin Uses More Electricity -- Than Many Countries!","Wall Street, the Federal Reserve and the financial arm of Silicon Valley cant believe their luck. The cryptocurrency movement, the very rebellion that set out to defeat their hegemony, has provided t… [+7721 chars]",2021-09-03,http://unherd.com/2021/09/the-crypto-revolution-has-failed/,https://unherd.com/wp-content/uploads/2021/09/GettyImages-1230577642-scaled-e1630599410288-1.jpg
"S3 Ep48: Cryptographic bugs, cryptocurrency nightmares, and lots of phishing [Podcast]",Sophos.com,Latest episode - listen now!,"[02’00”] Security code flushes out security bugs.[15’48”] Recursion: see recursion.[26’34”] Phishing (and lots of it).[33’09”] Oh! No! The Windows desktop that got so big it imploded.
With Paul Duck… [+592 chars]",2021-09-03,https://nakedsecurity.sophos.com/2021/09/03/s3-ep48-cryptographic-bugs-cryptocurrency-nightmares-and-lots-of-phishing-podcast/,https://nakedsecurity.sophos.com/wp-content/uploads/sites/2/2021/01/nean-with-mic-wt-greys-1200.png?w=775
Twitter Will Soon Let You Tip People in Bitcoin,HYPEBEAST,"Twitter might soon start allowing its users to tip its favorite content creators in Bitcoin.The social network's head of consumer product, Kayvon Beykpour, responded to a tweet by researcher Alessandro Paluzzi, who first spotted the new feature, with emojis s…","Twitter might soon start allowing its users to tip its favorite content creators in Bitcoin.
The social network’s head of consumer product, Kayvon Beykpour, responded to a tweet by researcher Alessa… [+1555 chars]",2021-09-03,https://hypebeast.com/2021/9/twitter-tip-jar-bitcoin-payments-funny-tweets,https://image-cdn.hypb.st/https%3A%2F%2Fhypebeast.com%2Fimage%2F2021%2F09%2Ftwitter-tip-jar-bitcoin-payments-funny-tweets-tw.jpg?w=960&cbr=1&q=90&fit=max
"Why Bitcoin, Dogecoin, Ethereum -- and Coinbase, Too -- Are Moving Today",Motley Fool,Mixed news feels like good news for most cryptocurrencies today.,"What happened
As the week draws to a close, cryptocurrency prices are looking decidedly mixed in Friday morning trading. Here's how prices for several of the biggest names in cryptocurrency stand as… [+2725 chars]",2021-09-03,https://www.fool.com/investing/2021/09/03/why-bitcoin-dogecoin-ethereum-coinbase-moved/,https://g.foolcdn.com/editorial/images/641943/red-arrow-going-down-crosses-a-green-arrow-going-up.jpg
Buy this Under-the-Radar Crypto Before it Pops,Motley Fool,Massive capital inflows are coming to the decentralized exchange behind this totally not-a-breakfast token.,"Had you invested just $1,000 into PancakeSwap (CRYPTO:CAKE) tokens last October, you would be sitting on more than $20,000 in profits today. It hasn't even been a year since its launch, but the names… [+3369 chars]",2021-09-04,https://www.fool.com/investing/2021/09/04/buy-this-under-the-radar-crypto-before-it-pops/,https://g.foolcdn.com/editorial/images/640833/gettyimages-1286880382.jpg
Crypto Billionaire Changpeng Zhao To Cease Some Binance Services In Singapore Amid Regulatory Scrutiny,Forbes,Binance—controlled by billionaire Changpeng Zhao—said it will discontinue offering some of its products in Singapore after regulators announced last week that the world’s largest cryptocurrency exchange may be breaching rules in the city-state.,"Binance Bitcoin logo displayed on an Android phone. (Photo Illustration by Avishek Das/SOPA ... [+] Images/LightRocket via Getty Images)
SOPA Images/LightRocket via Getty Images
Binancecontrolled b… [+2834 chars]",2021-09-06,https://www.forbes.com/sites/jonathanburgos/2021/09/06/crypto-billionaire-changpeng-zhao-to-cease-some-binance-services-in-singapore-amid-regulatory-scrutiny/,https://thumbor.forbes.com/thumbor/fit-in/1200x0/filters%3Aformat%28jpg%29/https%3A%2F%2Fspecials-images.forbesimg.com%2Fimageserve%2F613591f8fbb8aa0ed76f4894%2F0x0.jpg
Crypto’s Rapid Move Into Banking Elicits Alarm in Washington,New York Times,The boom in companies offering cryptocurrency loans and high-yield deposit accounts is disrupting the banking industry and leaving regulators scrambling to catch up.,"As the company has expanded, regulators have become increasingly concerned. New Jerseys attorney general sent it a cease and desist letter in July, saying it sells a financial product that requires a… [+1595 chars]",2021-09-05,https://www.nytimes.com/2021/09/05/us/politics/cryptocurrency-banking-regulation.html,https://static01.nyt.com/images/2021/09/05/us/politics/00DC-CryptoBank-Illo/00DC-CryptoBank-Illo-facebookJumbo.jpg
